id,name,experience_level,hackathons_done,objective,preferred_languages,friend_registration,preferred_team_size,programming_skills,interest_in_challenges
48aacbf2-b0c3-4f37-a906-a35171d0e61b,Sofía Elena Wallace,Intermediate,4,"Hey! I'm Sofía Elena Wallace. For this datathon, I'm all about having a blast, meeting new people, and diving into all the amazing events they're planning. I'm looking to make some awesome connections and lifelong friends. I'll be the one with the biggest smile, asking silly questions, and laughing with fellow participants. My goal is to have an incredible experience, learn something new along the way, and leave with a sense of fulfillment. I'm all about making the most of this opportunity and having an unforgettable time!","['English', 'Spanish']",[],3,"{'Flutter': 2, 'IoT': 2, 'iOS Development': 7, 'Rust': 2, 'Agile Methodology': 7, 'Natural Language Processing': 7, 'MongoDB': 3}","['Restb.ai Challenge', 'Mango Challenge', 'AED Challenge']"
542d6e14-d321-4d97-8007-5c2ddc44c98a,Sònia Lluïsa Flynn,Advanced,9,"I'm here to crush it! I'm Sònia, a competitive programmer with a track record of 9 hackathons under my belt. My goal is to win this datathon by any means necessary. I've got my eyes on the prize and I'm not leaving until I bring it home. I'm willing to put in the long hours, sweat and tears to take top honors. No mercy, no quarter, just pure, unadulterated competition. Bring on the challenge and let's see who comes out on top!","['English', 'Catalan', 'Spanish']",[],4,"{'UI/UX Design': 9, 'HTML/CSS': 8, 'AWS/Azure/GCP': 8, 'Android Development': 6, 'Data Analysis': 9, 'Figma': 3, 'Rust': 9, 'SQL': 8, 'TensorFlow': 7, 'iOS Development': 8, 'Natural Language Processing': 4, 'Agile Methodology': 9}","['AED Challenge', 'Restb.ai Challenge', 'Mango Challenge']"
a8eba985-9aa7-4249-aeed-c32f06bc3215,Sophia Langley,Intermediate,5,"My goal for this datathon is to step outside my comfort zone and have an amazing experience. I'm looking forward to making new friends and connections, having fun with my teammates, and enjoying the different events and activities. I'm not too worried about winning - my focus is on being part of the datathon spirit and soaking up as much as I can from the sessions and workshops. Bring on the datathon vibes and memories to cherish!",[],[],4,"{'HTML/CSS': 7, 'React': 4, 'Flutter': 5, 'AWS/Azure/GCP': 7}","['AED Challenge', 'Mango Challenge', 'Restb.ai Challenge']"
14f87989-7458-41dd-a33d-e0f4abe675cc,Anna Vidal,Intermediate,2,"As a participant in this datathon, my objective is to dive deeper into machine learning and data visualization techniques while pushing my coding skills to the next level. I'm hoping to learn new tools, frameworks, and methodologies to help me tackle real-world problems. I'm not necessarily concerned with winning, but I do want to be able to walk away from this datathon with a solid understanding of the latest trends and a fresh perspective to apply to my studies and future projects. I'm looking forward to learning from others and gaining valuable experience!","['English', 'Catalan']",[],4,"{'Data Analysis': 4, 'Android Development': 5, 'TensorFlow': 5, 'Java': 2}","['AED Challenge', 'Restb.ai Challenge', 'Mango Challenge']"
817dfb8a-e3fc-4e19-bfcc-e73155b4971b,Marina Torras,Intermediate,4,"My goal for this datathon is to level up my skills! I'm looking forward to diving into new technologies and learning from the amazing people here. I'd love to improve my understanding of data analysis and visualization, and gain experience with new tools and languages. For me, it's all about personal growth and developing a stronger skillset. I'm hoping to take away some valuable takeaways and maybe even work on a project that solves a real-world problem. I'm excited to challenge myself and come away from this with new knowledge and expertise!","['Catalan', 'Spanish']",[],4,"{'Blockchain': 5, 'JavaScript': 3, 'IoT': 3, 'Android Development': 5, 'SQL': 7, 'AWS/Azure/GCP': 4}","['AED Challenge', 'Mango Challenge', 'Restb.ai Challenge']"
c89a5615-7e23-4fec-ab8c-36790fe67a5a,Anna-Marie Estellina Ross,Intermediate,1,"I'm all about going for gold! My top priority is to bring home that first-place trophy. I've studied programming for three years and have a taste of competition from my one hackathon experience. I'm ready to put my skills to the test and strategize my way to the top. I'll be pouring all my energy into building the most innovative and efficient solutions, networking with the best, and capitalizing on every opportunity to gain an edge. Don't expect me to socialize too much - my sights are set on the leaderboard!","['English', 'Catalan', 'Spanish', 'French', 'Italian']",[],4,"{'PostgreSQL': 5, 'Figma': 6, 'Docker': 5, 'Flutter': 6, 'Machine Learning': 7, 'Data Analysis': 6}","['AED Challenge', 'Mango Challenge', 'Restb.ai Challenge']"
888f5fc4-663f-4257-95ca-1ee258920a7f,Aurora Sempere Ferrer,Intermediate,2,"I'm Aurora, and my objective for this datathon is to dive deep into new technologies and skills. I'm looking forward to learning from other participants and industry experts, and putting my existing skills to the test. My goal is to come away from this event feeling more confident and proficient in areas I'm struggling with, and with a portfolio of innovative projects to showcase. I'm excited to take on new challenges and collaborate with others who share my passion for learning and growth.","['English', 'Catalan', 'Spanish', 'French']",[],4,"{'Blockchain': 7, 'Flask': 7, 'Flutter': 7, 'Computer Vision': 6, 'Python': 2, 'React Native': 4}","['Mango Challenge', 'AED Challenge', 'Restb.ai Challenge']"
e6ee1679-09ab-4a53-988e-bbfd4994de0f,Licia García Moretti,Beginner,2,I'm coming for the top spot! My objective for this datathon is to win it all. I've got my eye on the prize and I'm not leaving until I've grasped it. I've participated in two hackathons before and it's gotten me addicted - I love the thrill of solving complex problems under pressure. This datathon is my chance to prove myself and take my coding skills to the next level. I'm ready to put in the hard work and dedication necessary to stand out from the rest. Bring it on!,"['Catalan', 'Spanish', 'Italian']",[],4,"{'Data Analysis': 4, 'JavaScript': 3}","['Restb.ai Challenge', 'Mango Challenge', 'AED Challenge']"
99e91d06-2eb3-4bc4-9d40-21091a5b11ef,Sofía Ryder,Intermediate,2,"I'm aiming to crush the competition! My objective is to take home the top prize at this datathon by working my way to the top through relentless innovation and focus. I've got a strong foundation in programming, and I'm eager to flex my skills and take on the challenges head-on. Winning isn't just about bragging rights for me - it's a badge of honor and a chance to prove my skills to others. I'm ready to grind, collaborate with others, and push myself to the limit to come out on top!","['English', 'Spanish']",[],4,"{'Blockchain': 7, 'MongoDB': 7, 'c++': 3, 'ios': 2, 'Design': 4, 'python': 5, 'android': 2}","['AED Challenge', 'Mango Challenge', 'Restb.ai Challenge']"
46d62139-2038-4190-8f1c-cf20a84dd599,Nuria Gualba Bosch,Advanced,8,"My goal for this datathon is to soak up the fun and networking vibes! As someone who's participated in 8 hackathons before, I'm all about trying new things and meeting fellow data enthusiasts. I want to make meaningful connections with others, attend all the cool workshops and events, and have an overall fantastic experience. I'm excited to share my knowledge and learn from others, all while keeping a chill and social vibe going throughout the datathon. Can't wait to get this datathon started!",['Catalan'],[],4,"{'MongoDB': 5, 'Blockchain': 8, 'Computer Vision': 8, 'nlp': 8, 'react': 7, 'javascript': 6, 'css': 6, 'figma': 7, 'pytorch': 6, 'java': 7, 'git': 9, 'UI/UX': 5, 'ios': 7}","['Mango Challenge', 'Restb.ai Challenge', 'AED Challenge']"
e51a9836-ce42-4fa8-9ff1-4a3c73c40c51,Rebecca Sophia Thompson,Intermediate,1,"My objective for this datathon is to soak up as much knowledge and experience as possible. With only one hackathon under my belt, I'm eager to dive deeper into the world of data analysis and visualization. I want to learn new tools, techniques, and best practices to enhance my programming skills and stay ahead of the curve in my second year of uni. I'm open to feedback and guidance from mentors, and I'm looking forward to being part of a dynamic team that's passionate about learning and creating something amazing.",['English'],[],4,"{'Flutter': 6, 'Flask': 3, 'SQL': 4, 'JavaScript': 5, 'Machine Learning': 3, 'React Native': 3, 'TensorFlow': 2, 'Java': 6}","['Restb.ai Challenge', 'Mango Challenge', 'AED Challenge']"
7988b25c-ef84-4d1d-9657-392c40838dff,Ava Montgomery,Intermediate,4,"Hey! I'm Ava, and I'm super stoked to be at the datathon! For me, this event is all about connection and experience. I'm looking forward to meeting new people, making some awesome friends, and having a blast. I'm hoping to learn some cool new skills, but mainly, I just want to have a fantastic time. I'd love to participate in all the side events, hack some crazy projects, and make some unforgettable memories. So, here's to a datathon of friendship, laughter, and non-stop fun!",['English'],[],4,"{'React Native': 5, 'AWS/Azure/GCP': 4, 'Docker': 2, 'Agile Methodology': 5, 'UI/UX Design': 4, 'Flask': 2, 'React': 6}","['Restb.ai Challenge', 'AED Challenge', 'Mango Challenge']"
bbdfe060-cdd0-4e40-87e2-7b62fc8e2353,Sofia Valencia,Advanced,6,"My objective for this datathon is to focus on learning and skill-building. As a 3rd-year student with some experience in programming, I want to take this opportunity to step up my game and tackle new challenges. I'm eager to learn from industry experts, dive deeper into emerging technologies, and apply my skills to real-world problems. I'm looking to level up my coding skills, expand my problem-solving capabilities, and gain a deeper understanding of the latest trends in data science. I'm excited to learn from others and contribute to a collaborative atmosphere that fosters growth and knowledge-sharing!","['English', 'Spanish']",[],3,"{'TensorFlow': 5, 'Android Development': 9, 'IoT': 4, 'Natural Language Processing': 3, 'Figma': 3, 'Git': 6, 'iOS Development': 5, 'React': 5, 'PostgreSQL': 8, 'AWS/Azure/GCP': 4, 'Blockchain': 7, 'C++': 8, 'Data Visualization': 7}","['Mango Challenge', 'Restb.ai Challenge', 'AED Challenge']"
11c29ce1-a3c5-437f-98b8-08fe65683ee9,Alexandra Elena Moreno,Intermediate,5,"Hey there! I'm Alexandra Elena Moreno, and my goal for this datathon is simple - I'm here to win. With 5 hackathons under my belt and 2 years of programming experience, I'm confident in my skills, and I'm ready to push myself to the limit to take home the top prize. I'm all about learning from my mistakes and finding the most efficient solutions, and I'm willing to put in the extra effort to stay ahead of the competition. Bring on the challenges, and let's get ready to crunch some numbers!","['English', 'Spanish']",[],4,"{'Natural Language Processing': 6, 'Android Development': 6, 'Blockchain': 5, 'Python': 7, 'JavaScript': 3, 'UI/UX Design': 5, 'Go': 4}","['AED Challenge', 'Mango Challenge', 'Restb.ai Challenge']"
0108b270-8223-4509-9074-c84809765b33,Ana Maria Flynn,Intermediate,1,"My goal for this datathon is to dive headfirst into new technologies and tools to further develop my programming skills. I'm looking forward to working on challenging projects that push me out of my comfort zone and help me learn from others. I'd love to absorb as much knowledge as possible from the mentors and fellow participants, and leave with a solid understanding of topics that will help me grow as a programmer. I'm not worried about winning or competing; I just want to take away new skills and experiences that will make me a better developer.","['English', 'Spanish']",[],4,"{'iOS Development': 2, 'Flutter': 7, 'React': 7, 'C++': 5, 'Docker': 4}","['Mango Challenge', 'Restb.ai Challenge', 'AED Challenge']"
9bc9dd43-3263-4c73-ae0a-e9acd4299976,Sofía Elena Wright,Advanced,8,"My objective for this datathon is to take home that trophy and prove to myself that I can do it! I've been preparing for months, honing my skills and studying up on the latest trends. I'm not interested in just winging it or socializing - I want to dive deep into the challenges, brainstorm innovative solutions, and push myself to the limit. I'm confident in my abilities, and I'm eager to show everyone what I'm capable of. Bring it on, I'm ready to crush it!","['English', 'Spanish']",[],4,"{'Data Visualization': 7, 'C++': 3, 'React': 3, 'AWS/Azure/GCP': 9, 'Java': 4, 'Flutter': 4, 'Figma': 5, 'Python': 5}","['Restb.ai Challenge', 'AED Challenge', 'Mango Challenge']"
cf7874b6-6b9a-492e-9621-089045a5b3be,Emily Rose Thompson,Intermediate,4,"Hi, I'm Emily! For this datathon, my objective is clear: I'm all about winning. I've been involved in four hackathons before, and I've got a good feel for the high-pressure environment. I'm confident in my skills, and I'm determined to push myself to the limit to take home the top prize. I'll be dedicating every waking moment to solving this datathon's challenge, experimenting with new ideas, and refining my approach. Bring it on - I'm ready to give it my all!",['English'],[],4,"{'Computer Vision': 4, 'Data Visualization': 3, 'UI/UX': 5, 'typescript': 2, 'iot': 2, 'postgres': 5}","['Mango Challenge', 'AED Challenge', 'Restb.ai Challenge']"
855ec9de-2464-4ab7-9dd3-af2d344b8d77,Alexandra Alex García,Intermediate,3,"I'm coming to the datathon with an eager mindset, excited to push my boundaries and learn new tricks. My goal is to improve my coding skills, especially with the tech stacks that will be featured during the event. I want to soak up knowledge and expertise from the other participants, mentors, and judges. I'm willing to step out of my comfort zone, take calculated risks, and learn from my mistakes. By the end of the datathon, I hope to have gained a better understanding of what it takes to be a rockstar developer and walk away with new perspectives and fresh ideas.","['English', 'Spanish']",[],4,"{'Android Development': 7, 'Blockchain': 6, 'Figma': 5, 'Flutter': 4, 'AWS/Azure/GCP': 6}","['AED Challenge', 'Restb.ai Challenge', 'Mango Challenge']"
3d5de216-4ef3-4b2c-9c47-0cfe50d4b636,Ava Lane,Beginner,2,"Hi! I'm Ava Lane, and I'm stoked to be participating in this datathon! My objective is to make some amazing friends, have a blast, and experience all the amazing events and activities they have to offer. I've heard these things can be super competitive, but that's just not my vibe. I'm all about learning new skills and having fun while doing it. I'm an 18-year-old newbie, and I'm hoping to soak up as much knowledge as I can while mingling with like-minded people. Bring on the coding marathons and social events - I'm ready to make some unforgettable memories!",['English'],[],4,"{'Go': 3, 'Figma': 4}","['Restb.ai Challenge', 'Mango Challenge', 'AED Challenge']"
171e9493-0a78-4d12-b554-a15426697400,Alexandra Lane,Beginner,1,"I'm stoked to be part of this datathon! My objective is all about making the most of this experience and having a blast with new people! I want to make genuine connections with fellow participants, learn from their expertise, and share my own enthusiasm for data science. I'm not necessarily after the top spot, but rather I'm looking forward to participating in as many events and workshops as I can, and soaking up the vibes. I'm all about having fun, being sociable, and taking in the electric atmosphere. Bring on the datathon camaraderie!",['English'],[],4,"{'Figma': 1, 'Android Development': 1, 'Blockchain': 4, 'JavaScript': 2}","['Restb.ai Challenge', 'Mango Challenge', 'AED Challenge']"
6fc3bd00-6bd3-49ae-9320-9c503a8627cc,Ava Morgan,Intermediate,5,"For me, this datathon is all about the vibes! I'm excited to soak up a weekend of hackery with like-minded people, make some new buddies, and have a blast doing it. I don't worry too much about winning or even coming up with a revolutionary project - I'd rather focus on learning some cool new tech skills, attending rad workshops and talks, and just enjoying the ride. And hey, who knows, maybe I'll even snag some swag prizes along the way!",['English'],[],4,"{'TensorFlow': 4, 'Docker': 5, 'Android Development': 4, 'HTML/CSS': 3, 'IoT': 4, 'Data Analysis': 6}","['AED Challenge', 'Mango Challenge', 'Restb.ai Challenge']"
baeb17b5-457d-4709-b3fd-8cdb8436dde4,Sofia Pujol,Advanced,9,"Hi! As Sofia, I'm super stoked to be part of this datathon! My objective is simple: I want to learn as much as I can and level up my skills. I'm a PhD student, so I'm always looking for opportunities to develop my programming skills and explore new technologies. I'm excited to dive into new challenges and experiment with different approaches. My ultimate goal is to come out of this datathon with a fresh perspective, some cool new projects, and a sense of accomplishment. I'm all about growth and learning, so bring on the challenges!","['English', 'Catalan']",[],4,"{'React Native': 8, 'Flutter': 9, 'Data Analysis': 4, 'Git': 5, 'MongoDB': 5, 'Java': 9, 'Computer Vision': 5, 'C++': 9, 'TensorFlow': 8, 'React': 8, 'Blockchain': 5}","['Restb.ai Challenge', 'Mango Challenge', 'AED Challenge']"
bbba2b20-0c61-4a25-96f8-eccf1facd63e,Emily Sanchez,Intermediate,2,"For this datathon, I'm all about having an awesome time and soaking up the experience! My main objective is to make new friends and memories while learning from others. I'm more about the vibe and having fun than being super competitive - I just want to relax, enjoy the events, and be a part of the datathon community. I'm excited to see what everyone's working on, attend the workshops and talks, and just enjoy the energy of the datathon! Let's make some unforgettable moments together!","['English', 'Spanish']",[],3,"{'Blockchain': 2, 'Go': 4, 'TensorFlow': 3, 'Docker': 6}","['Restb.ai Challenge', 'AED Challenge', 'Mango Challenge']"
3f0d9e2a-527c-48ae-9c97-ceebbe64c2f5,Alexis Rivero,Beginner,1,"My objective for this datathon is straightforward: I'm here to compete and crush it. I've got a hunger to win, and I'm willing to put in the effort to get there. I'm not here to make friends (although, who knows, I might actually make some awesome connections) - I'm here to prove to myself that I can take on a tough challenge and come out on top. Bring on the data, and let's see what I'm made of!","['English', 'Spanish']",[],4,"{'IoT': 1, 'Android Development': 4, 'C++': 3, 'JavaScript': 4}","['Mango Challenge', 'AED Challenge', 'Restb.ai Challenge']"
d7699727-7c41-4293-928c-0aff740b038a,Alexandra Ruby Winston,Intermediate,1,"My objective is clear: I'm here to crush it and bring home the win! As a hackathon novice with only one competition under my belt, I'm chomping at the bit to show off my skills and outdo the competition. I'll be pouring over the challenge criteria, strategizing with teammates, and grinding away at the code 24/7 to ensure that our project stands out from the rest. I'm not here to make friends (although that'd be awesome too), I'm here to win - so you can bet I'll be giving it my all!",['English'],[],4,"{'Figma': 6, 'Blockchain': 3, 'Machine Learning': 4, 'Android Development': 2, 'iOS Development': 6}","['Restb.ai Challenge', 'AED Challenge', 'Mango Challenge']"
73acdd47-aebe-4f85-a5ce-cd9cf24cffee,Astrid Samantha Rodriguez,Beginner,0,"Hey there! As Astrid Rodriguez, my objective for this datathon is to dive headfirst into learning and improvement. I've had minimal experience with programming so far, and I'm super excited to take on new challenges and expand my skill set. I'm looking forward to hands-on learning, taking feedback from mentors, and working on innovative projects that push me out of my comfort zone. My main goal is to return home with a bunch of new tricks up my sleeve, and I'm ready to put in the work to make it happen!","['English', 'Spanish']",[],4,"{'UI/UX Design': 4, 'C++': 4, 'Java': 4}","['AED Challenge', 'Mango Challenge', 'Restb.ai Challenge']"
5a5dd6bb-ea9b-40e7-93f4-dc97ac3ad8ed,Sofia Ellis Rivera,Intermediate,5,"My objective for this datathon is to use the challenge as an opportunity to level up my skills and knowledge. I'm in my fourth year of uni, and I've participated in five hackathons already, but I'm eager to dig deeper into the latest tech trends and approaches. I want to take on new projects, experiment with different tools and languages, and learn from the expert mentors and peers here. Ultimately, I'm hoping to return to my studies with fresh ideas and perspectives, and maybe even develop some new hobbies or interests.","['English', 'Spanish']",[],3,"{'UI/UX Design': 7, 'Computer Vision': 2, 'C++': 3, 'iOS Development': 4, 'Machine Learning': 7, 'Python': 7, 'Android Development': 5}","['Mango Challenge', 'AED Challenge', 'Restb.ai Challenge']"
4e6785b4-cd60-404c-9547-761c2e617436,Ava Emerson Wright,Intermediate,3,"I'm super competitive and I'm here to win! My objective is to use my programming skills to craft the most innovative and useful data-driven solution. I want to dominate the leaderboard and be crowned the ultimate champion. I'm going to put in the long hours, dig deep into the data, and push myself to the limit to ensure I've submitted the best project possible. Bring it on, I'm ready for this! My goal is to win, period.",['English'],[],3,"{'React': 6, 'Flask': 4, 'C++': 6, 'Blockchain': 3, 'Git': 6, 'Data Analysis': 6, 'Android Development': 3, 'TypeScript': 6, 'Go ': 3}","['AED Challenge', 'Restb.ai Challenge', 'Mango Challenge']"
4de50c67-e4a6-4f0c-a850-0fd0881d03db,Rosa Maria Ferrer.,Beginner,0,"I'm Rosa, and my objective for this datathon is to give it my all and win. I'm competitive by nature, and I'm eager to put my beginner programming skills to the test. I've always been fascinated by data analysis, and I believe that this event is the perfect opportunity to learn from others, collaborate, and prove myself. I'm looking forward to the challenge, and I'm willing to work hard to stand out from the crowd. My ultimate goal is to take home the top prize and get recognized as one of the best.","['Catalan', 'Spanish']",[],4,"{'Rust': 2, 'UI/UX Design': 4}","['Restb.ai Challenge', 'AED Challenge', 'Mango Challenge']"
ddc24869-63e6-4ed7-8f99-8101b1a3190c,Lena Victoria Flynn,Intermediate,2,"My main objective for this datathon is to gain as much knowledge as possible and improve my programming skills. I've had some experience at two previous hackathons, but I know there's still so much more to learn. I'm excited to be surrounded by experts and industry professionals, and I'm hoping to take away some practical tips and tricks to apply to my projects back in university. I'm happy to work in teams and collaborate with others, but ultimately, I'm here to challenge myself and come away with a newfound level of proficiency in data science.","['English', 'German']",['d95659ab-ee99-45a2-bfc1-aca8bfca4359'],4,"{'MongoDB': 4, 'python': 5, 'iot': 7, 'tensorflow': 3, 'postgres': 7, 'pytorch': 5, 'docker': 7, 'java': 2}","['AED Challenge', 'Restb.ai Challenge', 'Mango Challenge']"
6bcecb25-380b-452d-8f49-cca09caf185d,Soledad García,Beginner,1,"Hey there! So, for this datathon, I'm all about having a blast and making some new connections. I don't really care about competing to win (this time around, at least). I just wanna have fun, attend as many events as I can, and learn from the experience. I'm hoping to meet fellow data enthusiasts, grab some snacks and laughs with them, and just enjoy the atmosphere. Plus, who knows, maybe I'll even stumble upon some cool tools and techniques to improve my skills a bit too. Let's just say I'm all about chill vibes and socializing at this datathon!",['Spanish'],[],4,"{'Python': 3, 'C++': 2}","['Mango Challenge', 'AED Challenge', 'Restb.ai Challenge']"
c9696b90-2bda-4061-afd6-2f384d9f8cca,Eva Moreno.,Intermediate,1,"Hey there! So, my objective for this datathon is pretty straightforward - I want to level up my data skills and learn as much as I can from this experience. I'm still relatively new to programming and this event is the perfect opportunity for me to dive deeper into data analysis and visualization. I'm hoping to take away new knowledge, refine my skills, and maybe even get some inspiration for future projects. No pressure, no competition, just pure learning and skill-building - that's my aim!","['English', 'Portuguese']",[],4,"{'Flask': 6, 'Android Development': 3, 'React Native': 7, 'AWS/Azure/GCP': 2, 'Agile Methodology': 4}","['Mango Challenge', 'AED Challenge', 'Restb.ai Challenge']"
1d79de75-8571-4e2b-8fa1-368f8dab4c7b,Elsa Catalina Rossello Monti,Intermediate,1,"Hey, I'm Elsa! For this datathon, my primary objective is to go all out and give it my best shot to win. I'm eager to show off my coding skills and make a name for myself in the community. I'm not afraid to put in the extra effort to understand the challenges and create something innovative. My ultimate goal is to emerge victorious, so expect me to be fully focused and intense throughout the event. Bring it on, I'm ready to take on the competition and prove myself!","['English', 'Catalan', 'Spanish', 'Italian']",[],4,"{'IoT': 3, 'Git': 2, 'Android Development': 5, 'Data Analysis': 5, 'HTML/CSS': 6, 'Docker': 5, 'UI/UX Design': 3, 'React': 5, 'Flutter': 5}","['AED Challenge', 'Mango Challenge', 'Restb.ai Challenge']"
