id,name,experience_level,hackathons_done,objective,preferred_languages,friend_registration,preferred_team_size,programming_skills,interest_in_challenges
18c75be1-5d32-4405-9460-ddf2811668a9,Léonora Fèlix-Castel,Intermediate,4,"Hi! I'm Léonora. For this datathon, I'm all about vibes, man. I want to make some new friends, have a blast, and participate in as many events as I can. I'm not about competing or winning (not that I wouldn't love to though!). I'm all about learning, laughter, and networking. My objective is to immerse myself in the datathon experience, learn new tricks, and get to know fellow data enthusiasts. I'm excited to make memories, share experiences, and discover hidden gems within the community!","['English', 'Catalan', 'French']",[],4,"{'Machine Learning': 3, 'Docker': 4, 'Data Visualization': 4, 'IoT': 4, 'Android Development': 2, 'TypeScript': 5, 'Git': 3, 'PostgreSQL': 7}","['Restb.ai Challenge', 'Mango Challenge', 'AED Challenge']"
899f85bb-6a05-4aa9-a3d6-b68d9e7ec2ce,Lorenzo Santos Rivera,Intermediate,1,"Hey, I'm Lorenzo! For me, this datathon is all about making unforgettable memories, learning from awesome mentors, and getting to know the other participants better. My objective is to make new friends, have a blast, and participate in as many events and activities as I can. I'm all about embracing the datathon spirit and making this an experience I'll always cherish. No pressure, just pure excitement! I'll be sure to stay flexible, adapt to new situations, and soak up as much as I can - all while having an amazing time!","['Spanish', 'Italian']",[],3,"{'iOS Development': 3, 'AWS/Azure/GCP': 5, 'Go': 2, 'Android Development': 6, 'Java': 2}","['AED Challenge', 'Restb.ai Challenge', 'Mango Challenge']"
033af7f0-6b3f-40d8-8e24-5aac8cfc8299,Sofía Rachel Grant,Beginner,1,"Hey there! My name is Sofía, and I'm super excited to be a part of this datathon. My goal is to dive head-first into the world of data analysis and machine learning. I'm hoping to learn as much as I can from the other participants, mentors, and speakers. I want to improve my programming skills, specifically my Python skills, and explore new tools and technologies. Ultimately, I'm looking to challenge myself and come away from this event with a deeper understanding of data analysis and a few new tricks up my sleeve!","['English', 'Spanish']",[],4,"{'TypeScript': 4, 'Flutter': 4, 'Blockchain': 4}","['AED Challenge', 'Mango Challenge', 'Restb.ai Challenge']"
a82e8bf9-2c74-4afd-ba71-4526c73cc133,Eva Pagès,Beginner,2,"For me, this datathon is all about learning and growth. I've had limited experience with programming, but I'm eager to dive deeper and improve my skills. I want to soak up knowledge from the experts and challenges, and experiment with new technologies and methodologies. My goal is to take away tangible takeaways, from understanding industry-standard tools to tackling real-world problems. I'm looking forward to being pushed out of my comfort zone and returning home with a renewed sense of confidence and skills to apply in my studies and beyond!","['English', 'Catalan']",['8e90a768-41d7-4cbc-826b-9e0b3453f3d2'],3,"{'TypeScript': 3, 'C++': 1}","['AED Challenge', 'Restb.ai Challenge', 'Mango Challenge']"
46c45c96-a708-465f-8bbc-30a40a98d0f6,Aurélien Wellesley,Intermediate,2,"As I approach this datathon, I'm more excited than competitive. My objective is clear: I want to learn new tricks and level up my skills in data science and programming. I'm eager to dive deeper into cutting-edge techniques, explore different tools and languages, and broaden my understanding of data analysis. While I'm sure the other participants will crush it, I'm happy to help out, receive feedback, and participate in as many activities as possible. By the end of this datathon, I aim to feel more confident, knowledgeable, and ready to take on more complex data-driven projects. Bring it on!","['English', 'French']",[],4,"{'PyTorch': 7, 'Android Development': 3, 'UI/UX Design': 6, 'SQL': 3, 'iOS Development': 5}","['AED Challenge', 'Restb.ai Challenge', 'Mango Challenge']"
4773d247-252d-467f-be51-b391ba96d9d6,Ana Lucía Rodríguez Martínez,Intermediate,5,"I'm all about winning here. My objective is crystal clear: to take home the top prize and be crowned the champion. I'm ready to pour my heart and soul into this datathon and give it my absolute best shot. I've been honing my coding skills in hackathons and I'm confident that my experience will pay off. I'm excited to test my limits, work tirelessly, and outsmart the competition. Bring it on!",['Spanish'],[],4,"{'Git': 3, 'React': 2, 'Docker': 4, 'IoT': 6}","['Mango Challenge', 'Restb.ai Challenge', 'AED Challenge']"
484a6bc5-49f9-46ce-a653-3a9dced131ed,Maya Rose Windsor,Beginner,0,"My goal for this datathon is to come out on top - I'm a competitive person at heart, and I'm driven to win. I've always been impressed by the impressive projects that I've seen being presented at hackathons, and I'm eager to contribute to the world of data analysis. My plan is to dig deep, learn as much as I can about the topic, and push myself to come up with a unique and innovative solution. Bring it on!",['English'],[],4,"{'IoT': 2, 'UI/UX Design': 2, 'Machine Learning': 2, 'Figma': 3}","['Restb.ai Challenge', 'AED Challenge', 'Mango Challenge']"
f9e8ef17-ac90-4525-a94d-d53138d30adb,Astrid Elsa Valencia,Beginner,1,"Hey! My objective for this datathon is to really challenge myself and push my coding skills to the next level. I'm still a beginner, so I'm hoping to learn new techniques, get exposure to different tools and technologies, and maybe even take away some real-world projects to improve my portfolio. I'm not really competitive, to be honest - I'd much rather be struggling with a tough problem and figuring it out than worrying about winning a prize. For me, it's all about growth and becoming a better developer by the end of it.","['English', 'Spanish', 'German']",[],4,"{'Go': 1, 'Rust': 2, 'HTML/CSS': 1, 'Flutter': 4}","['Restb.ai Challenge', 'AED Challenge', 'Mango Challenge']"
dea29315-7adc-40a0-8e37-f670b315a406,Elisabeth Kühnel,Intermediate,1,"Hey there! As Elisabeth Kühnel, my objective for this datathon is crystal clear: I'm all about bringing home that win! I've got my sights set on the top prize and I'm willing to put in the sweat equity to make it happen. With my solid foundation in programming and experience from a previous hackathon, I'm confident in my abilities. This competition is all about testing my skills, pushing myself to the limit, and outdoing my fellow participants. I'm ready to dig deep, stay focused, and give it my all to come out on top.","['English', 'German']",[],4,"{'UI/UX Design': 5, 'JavaScript': 3, 'Data Analysis': 2, 'TensorFlow': 5, 'Computer Vision': 7}","['Restb.ai Challenge', 'AED Challenge', 'Mango Challenge']"
cd9b98a6-7cac-450c-a9aa-deb6a4edc539,I'd be delighted to introduce myself! My full name is Alexa Maria Santana.,Beginner,1,"I'm in this to win it! My objective is straightforward - I want to emerge victorious and take home the top prize. I've been studying and practicing programming non-stop, and I'm ready to put my skills to the test. I'm determined to give it my all and leave no stone unturned to prove myself as the best datathon participant. Expect me to be fiercely competitive and always pushing myself to think creatively and work efficiently. Bring on the challenges - I'm ready to take on the datathon!","['English', 'Spanish']",[],4,"{'Machine Learning': 2, 'Rust': 2, 'TypeScript': 4, 'Android Development': 4}","['AED Challenge', 'Mango Challenge', 'Restb.ai Challenge']"
cf82fba8-5162-4610-96cf-838eb8b011b6,Sofia Corbera,Intermediate,2,"My objective for this datathon is to have a blast and make new friends along the way! I'm all about soaking up the atmosphere, participating in as many events as I can, and having fun with like-minded people. I'm not as competitive as I could be, so I'm not too fussed about winning. Instead, I'm excited to chat with fellow participants, learn new things, and explore the data and technology on offer. If I happen to stumble upon some innovative ideas or pick up some new skills, that's a lovely bonus - but the real goal is to make memories and connect with others!","['English', 'Catalan', 'Spanish']",[],4,"{'Flutter': 2, 'IoT': 4, 'TensorFlow': 6, 'Android Development': 4, 'HTML/CSS': 4, 'MongoDB': 2, 'React Native': 2, 'iot': 4}","['Mango Challenge', 'Restb.ai Challenge', 'AED Challenge']"
805502fa-304f-4465-85f3-736270fec2ac,Madeleine Rose Harris,Intermediate,3,"Hey there! As a 20-year-old student, I'm excited to participate in the datathon as an opportunity to level up my programming skills. My objective is to immerse myself in new technologies, algorithms, and techniques, and learn as much as I can during this experience. I'm looking forward to working with other enthusiasts and mentors to build projects that challenge me and broaden my perspective. Ultimately, I hope to leave this datathon with a new set of skills, fresh ideas, and a boosted confidence in my abilities. Let's learn and grow together!","['English', 'French']",[],4,"{'React Native': 5, 'Natural Language Processing': 5, 'PyTorch': 7, 'Android Development': 7, 'Data Visualization': 6, 'Flask': 3, 'Python': 7}","['AED Challenge', 'Mango Challenge', 'Restb.ai Challenge']"
4b691f47-3677-41d9-adb9-ae06d320aa98,Aurélien Santiago Ellis,Intermediate,3,"I'm looking forward to leveling up my skills at this datathon! My goal is to dive deeper into machine learning and data visualization, and come out of here with a solid understanding of how to apply these concepts to real-world problems. I'm excited to learn from industry experts, get feedback on my work, and maybe even discover new tools or techniques to add to my toolkit. I'm not too concerned with winning; it's all about taking in as much as I can and growing as a developer.","['English', 'Spanish', 'French']",[],4,"{'JavaScript': 2, 'TypeScript': 5, 'Machine Learning': 5, 'SQL': 3, 'PostgreSQL': 4, 'Flask': 6, 'Docker': 5, 'HTML/CSS': 6, 'Android Development': 7}","['AED Challenge', 'Restb.ai Challenge', 'Mango Challenge']"
eefa7c80-b8f2-4dae-9aa6-2cac951e7ade,Lena Rachel Schmidt,Intermediate,4,"I'm all about leveling up my skills at this datathon! As a second-year student, I'm eager to dive deeper into new technologies and techniques. My goal is to tackle challenges and projects that push my comfort zone and help me improve my coding skills. I'm not too concerned about winning first prize, but rather want to absorb as much as I can from the experience. I hope to learn from fellow participants, snag some new ideas, and walk away from this event with a fresh set of skills to add to my belt.","['English', 'German']",[],4,"{'IoT': 5, 'Blockchain': 7, 'Data Analysis': 5, 'Python': 7, 'MongoDB': 4}","['AED Challenge', 'Mango Challenge', 'Restb.ai Challenge']"
9918f963-ce08-483f-af14-359dce6c97b5,Sofia Adélaide Langley,Intermediate,2,"I'm all about embracing the datathon vibes and making it a unforgettable experience! My objective is to mingle, learn, and have a blast with fellow attendees. I'm not obsessed with winning, and I'm not looking to improve my coding skills (although that's a bonus!). My focus is on soaking up the atmosphere, trying new foods, attending workshops, and meeting fellow coding enthusiasts. If I walk away with some awesome new friends and memories, that's the real prize for me!","['English', 'Spanish', 'French']",[],4,"{'Flask': 7, 'Blockchain': 7, 'TensorFlow': 6, 'SQL': 4, 'Docker': 6, 'Flutter': 3, 'Computer Vision': 2, 'Android Development': 4, 'AWS/Azure/GCP': 5}","['Mango Challenge', 'AED Challenge', 'Restb.ai Challenge']"
47452e8d-06ed-41d1-b7be-97e5d21b9f2b,Alejandra Sureda,Beginner,1,"I'm all about having a blast at this datathon! My goal is to make some awesome new friends, learn some new tricks, and participate in as many events as possible. I'm not too worried about winning, but more about soaking up the energy and vibes of the datathon. I'd love to collaborate with fellow participants, try out new tools and skills, and maybe even discover some new passions! At the end of the day, I just want to leave feeling fulfilled, happy, and maybe even a little bit smarter. Sound good to me!","['English', 'Catalan', 'Spanish']",[],4,"{'TypeScript': 4, 'HTML/CSS': 2}","['AED Challenge', 'Mango Challenge', 'Restb.ai Challenge']"
40377b40-9ff6-419c-b678-d60b4acbbb28,Alicia Sánchez,Intermediate,2,"I'm all about giving it my all and taking the competition by storm! As a relatively experienced hackathon participant, I'm hungry for a win and I know my coding skills are top-notch. I'm here to learn from the other participants, but my main goal is to take the top spot. I'll pour all my energy into this datathon, dedicating myself fully to building an innovative solution that truly stands out. I want to walk away with the trophy and the satisfaction of a hard-won victory. Nothing less will do for me!","['English', 'Catalan']",[],3,"{'iOS Development': 2, 'Flutter': 3, 'Data Visualization': 7, 'Blockchain': 6, 'JavaScript': 5, 'Go': 6, 'SQL': 3, 'UI/UX Design': 3, 'TensorFlow': 3}","['Mango Challenge', 'AED Challenge', 'Restb.ai Challenge']"
66e2c474-ac38-4b0f-a9a1-030ac5ed3e91,Lluïsa Santos Fleming,Intermediate,5,"Hi! My objective for this datathon is super chill - I just want to have a blast and make some awesome new friends. I'm all about vibing with like-minded people and seeing what creative projects we can come up with together. I'm not worried about winning or putting in overtime; I'm here to hang loose, enjoy the atmosphere, and participate in as many events as possible (except maybe the ones that require too much coding - ugh!). If we happen to create something awesome, that's just the cherry on top!","['English', 'Catalan', 'Portuguese']",[],4,"{'Figma': 3, 'TensorFlow': 4, 'Flask': 7, 'C++': 6, 'Go': 3, 'Computer Vision': 4}","['AED Challenge', 'Restb.ai Challenge', 'Mango Challenge']"
c877ced8-4145-46b1-baf6-beb6bdb64abe,Alessia Fiori,Intermediate,4,"For me, datathons are all about competition. I'm all in to try and take home that top prize! I've been programming for a few years now and I think I have a good grasp on some essential skills, but I'm ready to put my skills to the test and show off what I can really do. I'm focused on pushing myself to innovate, be creative, and deliver high-quality projects. My objective is to win, plain and simple. Bring it on, datathon challenges!",['Italian'],[],4,"{'Blockchain': 4, 'Flutter': 7, 'tensorflow': 4, 'docker': 7, 'c++': 5, 'java': 7, 'react': 4}","['Restb.ai Challenge', 'Mango Challenge', 'AED Challenge']"
88405a3f-2454-4593-a5f8-9099215602dc,Maria Elise Gastón,Beginner,0,"Hey there! I'm Maria, and my objective for this datathon is to come out on top. I'm determined to push myself to the limit and compete at my highest level. I've been practicing my coding skills and reviewing my favorite online tutorials, and I'm feeling pretty confident about my chances. My goal is to complete each challenge quickly and efficiently, and I'm willing to put in the late nights and extra effort to make sure I do. I want to prove to myself that I've got what it takes to win, and I'm ready to leave it all on the line.","['English', 'Catalan', 'Spanish', 'French', 'German']",[],4,"{'Flutter': 1, 'Python': 2, 'Git': 4}","['AED Challenge', 'Mango Challenge', 'Restb.ai Challenge']"
0db64060-0ccd-412e-84c9-566f8e299fd7,Mariona Fleur Escandell,Intermediate,1,"Hey! So, I'm super stoked to be part of this datathon! My main goal is to dive in and learn as much as I can. I've had some experience with programming, but I'm looking to level up my skills and explore new tools and techniques. I'd love to take on new challenges, ask questions, and get feedback from others. My objective is to come out of this datathon with a bunch of new knowledge and some practical experience under my belt. Bring it on!","['English', 'Catalan', 'Spanish', 'French']",['1ca5745c-e6e2-468b-89a1-82f9509873df'],4,"{'MongoDB': 4, 'PostgreSQL': 7, 'Agile Methodology': 6, 'Data Analysis': 5, 'iOS Development': 2, 'Android Development': 4}","['Restb.ai Challenge', 'AED Challenge', 'Mango Challenge']"
6bdc4a34-5b61-4ce2-95b5-efa7138b991b,Léa Montserrat Flynn,Intermediate,5,"Hey, I'm Léa! For this datathon, my main objective is to level up my skills and make the most out of this intense learning experience. I'm excited to dive into new tech challenges, explore innovative approaches, and refine my programming abilities. I'm not as focused on competing to win, but more on acquiring new knowledge and pushing myself outside my comfort zone. I'd love to connect with fellow participants and learn from their experiences, too. Let's crush some datasets and have some fun along the way!","['English', 'Catalan', 'French']",[],4,"{'Android Development': 6, 'Flutter': 7, 'IoT': 2, 'AWS/Azure/GCP': 2, 'MongoDB': 4, 'HTML/CSS': 2, 'Java': 2}","['AED Challenge', 'Mango Challenge', 'Restb.ai Challenge']"
54abb52e-415c-498c-9ec9-82af3da1be4e,Marie-Cecilia Élan.,Intermediate,3,"Hey there! My goal for this datathon is all about vibes, man! I'm stoked to be here, not to crush it competitively, but to hang loose, learn new stuff, and meet awesome people. I want to make meaningful connections, swap war stories, and share laughs with fellow datathon warriors. I'm down to participate in as many events as I can, from coding challenges to jam sessions, just to absorb the energy and enthusiasm. Bring it on, and let's have a blast together!","['English', 'Spanish', 'French']",[],4,"{'Data Visualization': 5, 'Agile Methodology': 3, 'Python': 4, 'IoT': 3, 'UI/UX Design': 5}","['AED Challenge', 'Mango Challenge', 'Restb.ai Challenge']"
141e6274-1c50-4244-bb4a-22e11023e6a7,Léonie Sophia Wellesley,Beginner,0,"I'm super stoked to be a part of this datathon! My goal is to learn as much as I can and improve my programming skills. I'm only in my first year of university, and while I've had some basic courses, I know I've got a lot to catch up on. I'm looking forward to immersing myself in the world of data and seeing what cool projects people come up with. Ideally, I'd love to learn some new tools and programming languages, and maybe even start to contribute to some open-source projects. I'm hoping this datathon will give me a great opportunity to do just that!","['English', 'Spanish', 'French', 'German']",[],4,"{'Rust': 3, 'Git': 4}","['Restb.ai Challenge', 'AED Challenge', 'Mango Challenge']"
7b93006c-37a4-4d9c-b125-3b0c2fbcdc31,Mercè Vilarrasa,Intermediate,5,"My objective for this datathon is clear: I'm here to win. As a seasoned hackathon veteran, I've learned from past experiences and I'm more determined than ever to take home the top prize. I've put in the extra hours to hone my skills and I'm confident in my ability to tackle even the most challenging problems. My goal is to not only impress the judges but also to outdo my competition. Bring it on! I'm ready to put everything on the line and give it my all to emerge victorious.",['Catalan'],[],4,"{'Flutter': 6, 'Data Analysis': 4, 'TensorFlow': 6, 'React Native': 2, 'React': 3, 'Agile Methodology': 5, 'HTML/CSS': 2, 'PyTorch': 4, 'Machine Learning': 3}","['AED Challenge', 'Mango Challenge', 'Restb.ai Challenge']"
1dc72def-33c1-4051-8119-8d4bd17cac91,Evelyn Paige Thompson,Intermediate,3,"My objective for this datathon is to have an absolute blast! I'm not about being a competitive powerhouse, but more about soaking up the atmosphere, meeting fellow datathon enthusiasts, and learning together. I'm excited to participate in as many events and challenges as I can, and I'm all about having fun with the team I'm working with. If we happen to whip up a mind-blowing solution along the way, that's just the cherry on top! My goal is to create unforgettable memories and take home a datathon spirit that's more precious than any prize.",['English'],[],4,"{'Blockchain': 3, 'MongoDB': 7, 'Android Development': 7, 'Java': 2, 'TypeScript': 2, 'Computer Vision': 6, 'Go': 2, 'Data Analysis': 4}","['Restb.ai Challenge', 'AED Challenge', 'Mango Challenge']"
ef12a15b-c5f9-437a-bf2f-441801549d55,Emilia Joy Wallace,Intermediate,2,"I'm super excited to be here! For this datathon, I'm all about having a blast and meeting like-minded people. My goal is to soak up the atmosphere, learn new skills, and, of course, make new friends! I'm not really competition-focused; I'd rather hang out at the cafe, attend all the workshop sessions, and participate in random events just to see what's going on. I want to absorb the datathon vibe and get the most out of this experience. Wish me luck, and let's have some fun!",['English'],[],4,"{'UI/UX Design': 4, 'Natural Language Processing': 3, 'Flutter': 2, 'AWS/Azure/GCP': 4, 'Blockchain': 6, 'Rust': 7, 'Android Development': 2}","['AED Challenge', 'Restb.ai Challenge', 'Mango Challenge']"
284ca131-00f9-482f-bc15-61be71c46c42,Ana Luísa Costa Ferreira,Intermediate,4,"Hey there! I'm Ana Luísa. As a 2nd-year student, I'm always looking for ways to improve my programming skills and expand my knowledge. For this datathon, my main objective is to make the most of this opportunity to learn from others and gain hands-on experience. I want to dive into new challenges, tackle difficult projects, and develop my problem-solving skills. I'm excited to learn from the organizers, mentors, and fellow participants, and I'm hoping to leave this event with new ideas, insights, and skills that will boost my skills and confidence in my academic and professional pursuits.",['Portuguese'],[],4,"{'Data Visualization': 3, 'MongoDB': 2, 'nlp': 3, 'UI/UX': 5, 'python': 6, 'java': 6}","['Restb.ai Challenge', 'Mango Challenge', 'AED Challenge']"
7d7b599e-b081-476a-98b4-ee570b74ba7f,Evelyn Wynter,Intermediate,2,"I'm looking forward to this datathon as an opportunity to relax and have a blast with fellow data enthusiasts. My objective is to make new friends, attend as many workshops and events as possible, and soak up the vibe. I'd love to learn new skills and pick up some fresh ideas, but my main goal is to make this a memorable and enjoyable experience. I'm hoping to bond with like-minded people over shared passions, share laughter and stories, and create some awesome memories - with maybe a hint of productivity sprinkled in!",['English'],[],4,"{'Flask': 2, 'IoT': 7, 'HTML/CSS': 4, 'Data Analysis': 3, 'Docker': 5, 'Android Development': 3, 'Java': 6, 'MongoDB': 3}","['Mango Challenge', 'Restb.ai Challenge', 'AED Challenge']"
08cb0baf-62ca-4340-a04b-dfe405231d2d,Maya Lane,Beginner,0,"My goal for this datathon is simple: I want to crush it and win! As a total beginner in the coding scene, I'm not naive about the competition, but I'm willing to put in the long hours and hustle to stand out from the crowd. I'm eager to learn new skills, absorb as much as I can, and prove to myself that I'm capable of producing something amazing. Bring it on - I'm ready to push myself to the limit and take home that trophy!",['English'],[],4,"{'Machine Learning': 1, 'Git': 2}","['Restb.ai Challenge', 'AED Challenge', 'Mango Challenge']"
6e5e57da-1dea-4df2-8c82-4e6f96f8c322,Sofia Dupont,Intermediate,2,"Hey! I'm Sofia Dupont, and my goal for this datathon is to take home that trophy. I've participated in a couple of hackathons before and have honed my skills to a decent level. Now, I'm here to put that to the test and show what I'm capable of. I'm looking forward to solving complex problems, crushing the competition, and, of course, taking advantage of the sweet, sweet prize money. It's gonna be a tough ride, but I'm ready to put in the hard work and dedication required to win.","['Spanish', 'French']",[],4,"{'Blockchain': 7, 'React Native': 5, 'IoT': 6, 'UI/UX Design': 2, 'Flutter': 5}","['Restb.ai Challenge', 'Mango Challenge', 'AED Challenge']"
87f8d6c7-57e9-42a2-ac89-f6c291aa7b08,Evie Mayson,Intermediate,5,"My goal for this datathon is to make the most of the experience! I'm all about having a blast, learning new things alongside awesome people, and taking part in as many events as I can. I'm excited to meet fellow datathon enthusiasts, get creative with coding, and soak up the fun atmosphere. I'm not too hung up on winning - if I happen to crush a challenge or two along the way, that's just a nice bonus! For me, it's all about the friendships, the laughter, and the unforgettable memories. Bring it on!",['English'],[],4,"{'IoT': 3, 'Machine Learning': 6, 'JavaScript': 3, 'Python': 4, 'Docker': 7, 'HTML/CSS': 4, 'Data Visualization': 7, 'Java': 6}","['AED Challenge', 'Mango Challenge', 'Restb.ai Challenge']"
c8375f0e-fecd-4c63-931b-c1e8e29ab4e5,Astrid Santiago Rodríguez,Intermediate,2,"Hey there! As Astrid, my objective for this datathon is all about soaking up the experience and making some unforgettable memories. I want to connect with like-minded folks, learn from their experiences, and share some laughs together. I'm more about having fun and participating in a variety of activities rather than focusing solely on winning. I'm all about embracing the vibe, trying new things, and growing as a person. I'm excited to meet new people, participate in workshops, and explore the city during the datathon - it's going to be an amazing adventure!","['English', 'Spanish']",[],4,"{'Machine Learning': 3, 'Docker': 5, 'JavaScript': 2, 'SQL': 5, 'TensorFlow': 7}","['AED Challenge', 'Mango Challenge', 'Restb.ai Challenge']"
