id,name,experience_level,hackathons_done,objective,preferred_languages,friend_registration,preferred_team_size,programming_skills,interest_in_challenges
2ebad15c-c0ef-4c04-ba98-c5d98403a90c,Sara Vilar,Intermediate,2,"I'm super stoked to be participating in this datathon! My goal is to soak up the vibes, learn from others, and have an absolute blast. I want to join in on as many events and workshops as I can, learn new skills and insights, and make friends with like-minded peeps. I'm more about having fun and making connections than about trying to win (although, I do love a good challenge!). My objective is to leave this datathon feeling refreshed, inspired, and with new friendships to look back on. Bring it on!","['English', 'Catalan']",[],4,"{'Data Visualization': 2, 'Flask': 4, 'React Native': 6, 'UI/UX Design': 3, 'TypeScript': 3, 'Git': 2, 'React': 5, 'MongoDB': 2, 'HTML/CSS': 5}","['Mango Challenge', 'Restb.ai Challenge', 'AED Challenge']"
a00428a2-14a2-4fb1-838a-22394778ec88,Aurora Wells,Intermediate,5,"For me, this datathon is all about leveling up my skills. As a third-year student, I'm looking to dive deeper into data analysis and visualization, and this is the perfect opportunity to learn from industry experts and get hands-on experience. My goal is to take what I learn here and apply it to my final year project, so I can walk away with some concrete skills that I can use in my future career. I'm not too fussed about the competition, but I am excited to challenge myself and come away feeling more confident in my abilities.",['English'],[],3,"{'React': 4, 'PostgreSQL': 5, 'Figma': 7, 'SQL': 2}","['AED Challenge', 'Mango Challenge', 'Restb.ai Challenge']"
ab4b5790-0e6b-43db-bbaa-8670554f0cc8,Anaïs Giacomo,Intermediate,2,"Hey! I'm Anaïs, and I'm all about growth and learning. For this datathon, I'm aiming to dive deep into new programming languages and data analytics tools. I'm eager to learn from others, attend workshops and mentorship sessions, and absorb as much knowledge as I can. My objective is to improve my skills, expand my repertoire, and take away practical experiences that I can apply to my upcoming projects and career. I'm not worried about competing; I'm more focused on fostering connections and exchanging ideas to become a better developer.","['English', 'Spanish', 'French', 'German', 'Italian']",[],4,"{'PostgreSQL': 4, 'TensorFlow': 5, 'Computer Vision': 6, 'Agile Methodology': 3}","['Restb.ai Challenge', 'Mango Challenge', 'AED Challenge']"
cda2fafe-4b1e-4581-9fe0-1fb6d3e79aa3,Luna Solà.,Intermediate,2,"I'm all about leveling up my skills at this datathon! My goal is to dive deeper into machine learning and AI, and come out with tangible projects that demonstrate my growth. I'm not too worried about winning; I'd rather focus on learning from others, taking calculated risks, and pushing myself outside of my comfort zone. I'm excited to learn from the experts, get feedback on my work, and maybe even discover new areas of interest. Bring on the data and the challenges - I'm ready to soak it all in and come out a better developer on the other side!","['English', 'Catalan']","['13a8194a-79a9-4004-8711-e6d89efa0014', '2a4877f6-c699-46a6-971f-1d1c75977ae8']",4,"{'IoT': 4, 'HTML/CSS': 6, 'MongoDB': 5, 'Blockchain': 6, 'AWS/Azure/GCP': 2, 'Figma': 6}","['Restb.ai Challenge', 'AED Challenge', 'Mango Challenge']"
624f4677-d31a-4ecf-a7de-5df7392f9579,Evelyn Winters,Intermediate,2,"I'm coming to this datathon to put my skills to the test and bring home that first-place trophy! I've got my eyes set on the prize and I'm not leaving until I win. I've honed my coding skills in hackathons before, and I'm ready to take on new challenges and push myself to the limit. My main goal is to come out on top, no matter what it takes. If that means sacrificing some fun to perfect my craft, then so be it. I'm all about competitive success - that's what gets my adrenaline pumping and my heart racing.",['English'],[],4,"{'iOS Development': 2, 'Flask': 6, 'TensorFlow': 2, 'AWS/Azure/GCP': 3, 'SQL': 2, 'Computer Vision': 4, 'MongoDB': 2, 'JavaScript': 6}","['Restb.ai Challenge', 'AED Challenge', 'Mango Challenge']"
e3464b47-0c0a-41d7-9750-a21adb889205,Emily Rachel Winston,Intermediate,4,"For me, it's all about growth and development. I'm looking to push my programming skills to the next level and expand my knowledge in areas I'm not too familiar with. I want to take advantage of the resources and expertise available during the datathon to improve my coding chops and get feedback from experienced mentors. My objective is to tackle complex challenges, learn from mistakes, and come out of this event feeling more confident and prepared to tackle real-world projects. Bring on the coding challenges!",['English'],[],4,"{'SQL': 6, 'Blockchain': 3, 'pytorch': 4, 'python': 4, 'Agile': 7, 'android': 4, 'react': 5}","['Restb.ai Challenge', 'AED Challenge', 'Mango Challenge']"
97a555b7-99a5-4a5e-8f47-631d5507e25a,Ruby Wynter,Intermediate,3,"Hey there! I'm Ruby, and my objective for this datathon is all about having a blast! I'm looking forward to making some awesome new friends and connections in the datathon community. I want to participate in as many events and activities as possible, whether it's a workshop, a meetup, or even just grabbing food with fellow participants. I'm all about soaking up the atmosphere and having a fun, stress-free experience. If I learn some new skills or make meaningful connections along the way, that's just the icing on the cake!",['English'],[],4,"{'iOS Development': 4, 'TensorFlow': 4, 'Rust': 7, 'Flutter': 5, 'Figma': 7}","['Mango Challenge', 'AED Challenge', 'Restb.ai Challenge']"
725b1704-4da0-423d-b51a-b465f2a41906,Ana Isabel Serraño.,Intermediate,5,"Here's my brief objective:

My goal for this datathon is to come out on top. I'm a competitor at heart, and the thrill of winning is what drives me. I've been involved in five hackathons so far, and I know what it takes to produce a winning project. I'm eager to take on the challenge, outdo my peers, and take home the top prize. I'll be putting in long hours, pushing myself to think creatively, and seeking out mentors and feedback to help me perfect my project. Let's get this win!","['English', 'Catalan', 'Spanish']","['ae5a6bbe-8911-4195-9589-4ce25d6ddc8e', 'b8d50918-f0b5-4452-aae3-c097eafd99ab']",4,"{'iOS Development': 4, 'UI/UX Design': 4, 'Java': 2, 'Rust': 4, 'JavaScript': 5}","['AED Challenge', 'Mango Challenge', 'Restb.ai Challenge']"
14cf6a5f-7e48-49c8-9e59-522fe1178ad8,Alessandra Pérez Oliveira,Intermediate,5,"Hey! My objective for this datathon is to make the most of the experience and have an absolute blast. I'm all about learning new things and networking, but I'm more interested in the social aspect and having fun with my fellow participants. I'm hoping to take advantage of all the events, workshops, and activities the datathon has to offer, and meet some amazing people who share similar interests. I'm looking forward to sharing laughter, creating memories, and making new friends!","['English', 'Catalan', 'Portuguese']",[],4,"{'Agile Methodology': 6, 'PostgreSQL': 6, 'iOS Development': 3, 'Flask': 6, 'HTML/CSS': 4, 'Flutter': 7}","['Mango Challenge', 'Restb.ai Challenge', 'AED Challenge']"
359f324b-b3ec-4770-8a60-86493503fee4,Alessia Winston,Intermediate,5,"My objective for this datathon is to bring home the win! I'm a competitive person and I thrive under pressure, so I'm going all out to make this the best hackathon experience I've had yet. I'm looking forward to tackling complex challenges, working with a tight-knit team, and pushing myself to deliver a winning solution. I'm not just in it for the glory, though - I also want to prove to myself that I've got what it takes to be a top-notch developer. So, expect to see me intensely focused on problem-solving and code-crafting my way to victory!","['English', 'Italian']",[],4,"{'PostgreSQL': 3, 'IoT': 6, 'Blockchain': 7, 'Python': 5}","['Restb.ai Challenge', 'AED Challenge', 'Mango Challenge']"
7961223b-759b-43e9-b817-99f9d6878f46,Antoine Lefebvre.,Intermediate,2,"Hey, it's me, Antoine! My objective for this datathon is to make some amazing friends, have a blast, and soak up as many experiences as I can. I'm all about vibing with fellow participants, sharing stories, and picking each other's brains. I'm hoping to attend panels, join workshops, and jam out with the dev community. Bring on the swag, the laughter, and the memories! My goal is to leave with new connections, a spring in my step, and a sense of adventure. I'm in it for the ride, and I'm stoked to share it with everyone!",['French'],[],4,"{'Docker': 3, 'Data Visualization': 4, 'SQL': 6, 'Python': 6, 'Natural Language Processing': 2, 'JavaScript': 7, 'React Native': 4, 'C++': 2}","['Restb.ai Challenge', 'Mango Challenge', 'AED Challenge']"
9fe09efc-d630-48c7-9a4d-f0cf09670a13,Ava Wynter,Beginner,0,"I'm stoked to be at this datathon! My goal is to come away with some awesome new skills and knowledge to take back to my university degree. I've just started learning to code, and I'd love to gain more confidence and experience with real-world projects. I'm all about absorbing as much as I can from the workshops and mentorship sessions, and I'm excited to collaborate with other participants to build something innovative. My primary focus is on leveling up my skills, and I'm excited to see where this journey takes me!",['English'],[],4,"{'Rust': 1, 'Go': 4}","['AED Challenge', 'Restb.ai Challenge', 'Mango Challenge']"
b5af3cda-f580-4f90-a73a-4f13801dcc57,Sofia Rose Navarro,Intermediate,2,"My objective for this datathon is all about the vibes! I'm not here to stress about winning, and I'm not trying to level up my coding skills (at least, not too much, haha!). I'm looking forward to making new friends, having a blast, and participating in as many events as I can. I want to soak up the datathon atmosphere, try new things, and walk away with some amazing memories. I'm all about having fun and learning from the experience, so bring on the datathon shenanigans!","['English', 'Spanish']",[],4,"{'Blockchain': 4, 'PostgreSQL': 2, 'Computer Vision': 5, 'Python': 3, 'TypeScript': 6}","['Mango Challenge', 'AED Challenge', 'Restb.ai Challenge']"
fc5ab53d-376c-495d-8c48-3baf8ecfc6ed,Ava Flynn,Beginner,1,"Hey! As a beginner coder, I'm super excited to be participating in this datathon. My objective is to soak up as much knowledge as I can and push my programming skills to the next level. I'm hoping to get exposed to new technologies, techniques, and ideas that will help me become a better programmer. I'm not too concerned about winning (although it's nice too); what matters most to me is having the opportunity to learn and grow with the support of the community and my fellow participants. I'm ready to get coding and take in as much as I can!",['English'],[],4,"{'HTML/CSS': 4, 'SQL': 1}","['Restb.ai Challenge', 'Mango Challenge', 'AED Challenge']"
f257011d-9eab-4622-adda-02392f0fa8ca,Mariona Wells,Intermediate,5,"I'm Mariona, and I'm super excited to participate in this datathon! My objective is to dive headfirst into this challenge and level up my skills. I've been doing hackathons for a few years now, and I'm looking forward to putting my knowledge to the test. I want to learn new things, experiment with different tools, and refine my programming skills. I'm open to trying new approaches and approaches, and I'm hoping to come out of this with some sweet new techniques and a bunch of fun projects to add to my portfolio. Bring it on!","['English', 'Catalan']",[],4,"{'AWS/Azure/GCP': 3, 'React': 3, 'SQL': 2, 'Python': 6}","['Restb.ai Challenge', 'AED Challenge', 'Mango Challenge']"
57fffc51-bcc8-4c36-afbe-795295e4a009,Alejandro Vicens Rodríguez,Intermediate,1,"My objective for this datathon is clear: I'm here to win. As a second-timer, I've learned the importance of getting to work quickly and efficiently, and I'm confident that my Intermediate-level programming skills will give me an edge. I'm not looking to make friends or party - although I'm sure that will be a bonus! - but instead, I'm laser-focused on crushing the competition. Bring on the challenges and hackathons, I'm ready to put my skills to the test and take home the top prize.","['English', 'Catalan', 'Spanish']",[],4,"{'Git': 3, 'Rust': 4, 'Figma': 2, 'Natural Language Processing': 2, 'Python': 2, 'Data Analysis': 4, 'iOS Development': 4}","['AED Challenge', 'Restb.ai Challenge', 'Mango Challenge']"
22df404a-20e7-40e9-a9ad-59a743dff09f,Sofía Elena Russell.,Beginner,0,"My goal for this datathon is to come out on top! I'm hungry to compete against other talented individuals and prove to myself that I've got what it takes to win. I'm always up for a good challenge and can't wait to dive into the task at hand. I'm planning to put in the extra hours, perfect my code, and give it my all to emerge victorious. Bring on the competition!","['English', 'Spanish']","['b6922470-df9d-4b64-84e6-6852f681f69c', '325e158b-bd36-48f6-9aea-cf55426808fb']",3,"{'IoT': 1, 'Rust': 4, 'TypeScript': 4}","['AED Challenge', 'Restb.ai Challenge', 'Mango Challenge']"
50ac00ab-42d5-40ae-a7da-ad69a687b7cb,Emily Ann Welles,Advanced,5,"Hey! So, my objective for this datathon is pretty straightforward: I want to improve my skills and learn new things. With 5 hackathons under my belt, I'm looking to take my programming skills to the next level and experiment with new technologies. I'm hoping to push myself out of my comfort zone and learn from others in the community. Specifically, I'm interested in exploring areas like machine learning and data visualization, so I'd love to attend talks and workshops related to those topics. Let's see how far we can take our skills this weekend!",['English'],[],4,"{'Android Development': 4, 'JavaScript': 7, 'TypeScript': 7, 'Blockchain': 9, 'C++': 6, 'MongoDB': 5, 'Python': 4, 'AWS/Azure/GCP': 9, 'React': 9, 'HTML/CSS': 5, 'Git': 9}","['AED Challenge', 'Mango Challenge', 'Restb.ai Challenge']"
c987a232-e738-47c0-8e54-f6bfd9f2a16b,Sofia Miralbell,Intermediate,4,"Hi! As Sofia Miralbell, my objective for this datathon is to give it my all and bring home the win. I've participated in a few hackathons before, and I'm eager to take my skills to the next level. I'm looking to work tirelessly to create an innovative solution that wows the judges. I've been preparing my code and researching relevant topics in-depth. My goal is to emerge victorious and feel the sense of accomplishment that comes with winning a datathon. Bring on the challenge!","['English', 'Catalan']",[],4,"{'Computer Vision': 6, 'Rust': 5, 'Data Analysis': 2, 'MongoDB': 6, 'Go': 3, 'Python': 6, 'Agile Methodology': 5}","['AED Challenge', 'Restb.ai Challenge', 'Mango Challenge']"
d968f665-4353-487e-9c71-520a23c808a0,Aurélia Windsor,Intermediate,2,"Hey there! I'm Aurélia, and I'm stoked to be joining the datathon! My goal is to dive deep into the world of data and sharpen my skills. I've had some exposure to programming through my degree, but I know there's still so much to learn. I'm looking forward to immersing myself in the process, getting hands-on with new tools and tech, and leveling up my data game. I'm not too focused on winning - I just want to take away concrete learnings and new experiences that'll help me grow as a developer. Bring it on!","['English', 'French']",[],4,"{'Android Development': 4, 'Java': 2, 'Blockchain': 3, 'Go': 4, 'Agile Methodology': 4}","['Mango Challenge', 'AED Challenge', 'Restb.ai Challenge']"
2811f7b6-1730-4db2-9561-f0beeeb18620,Sofia Rodriguez,Advanced,4,"My objective for this datathon is to level up my skills and take my programming abilities to the next level. I'm not here to just show off, but to challenge myself and push my limits. I'm excited to dive into new technologies, tools, and techniques, and apply them to real-world problems. I'm looking forward to collaborating with other passionate developers and learning from each other. Ultimately, I want to walk away from this datathon with a newfound confidence and a toolbox full of fresh skills to take back to my studies and future projects.","['English', 'Spanish']",[],4,"{'iOS Development': 8, 'Flutter': 8, 'Git': 8, 'TypeScript': 6, 'Android Development': 7, 'TensorFlow': 8, 'React': 5, 'MongoDB': 5, 'Figma': 8, 'PostgreSQL': 9, 'JavaScript': 8, 'UI/UX Design': 5, 'IoT': 6}","['AED Challenge', 'Mango Challenge', 'Restb.ai Challenge']"
f77aaea7-6e9e-4fac-b919-cdddd1c11c14,Aurèlia Fleur Morelli,Advanced,7,"Hey! So, I'm really excited to be here at the datathon! My goal is to take this opportunity to improve my programming skills and learn from others. I've already got a solid foundation in coding, but I know there's always more to learn and I'm eager to dive deeper into new tools and techniques. I'm looking forward to collaborating with others, asking questions, and getting feedback to help me grow as a developer. I'm all about self-improvement, so expect me to be fully engaged and soaking up all the knowledge I can get!","['Catalan', 'French', 'Italian']",[],4,"{'iOS Development': 3, 'Docker': 3, 'Rust': 7, 'Flask': 3, 'JavaScript': 3, 'React Native': 3, 'Flutter': 7, 'TypeScript': 5, 'SQL': 5, 'Data Analysis': 9, 'C++': 9}","['Restb.ai Challenge', 'Mango Challenge', 'AED Challenge']"
553ec5f7-34b6-4926-93de-c6f71f9b39b7,Aurora Isabella,Intermediate,5,"Hey there! So, my objective for this datathon is pretty straightforward: I want to improve my skills and take my programming skills to the next level. I've participated in a few hackathons already, and I've learned a ton, but I know there's still so much to learn. I'm excited to work with a new set of tools and teammates to challenge myself and expand my horizons. I'm all about continuous learning, and this datathon is the perfect opportunity for me to do just that.","['English', 'Spanish']",[],4,"{'TensorFlow': 5, 'MongoDB': 2, 'iOS Development': 6, 'React Native': 3, 'IoT': 6, 'Machine Learning': 7, 'Blockchain': 4, 'Go': 4, 'Android Development': 4}","['Restb.ai Challenge', 'Mango Challenge', 'AED Challenge']"
45652493-3559-4233-9b9c-23010dc7f814,Anna María Garcia,Intermediate,1,"I'm all about vibin' with fellow datathoners! For me, this datathon is about making new friends and having an absolute blast. I'm excited to participate in as many events as I can, like workshops, mini-competitions, and even social activities. I want to explore new skills and techniques, but mostly, I want to connect with like-minded people and share laughter and memories. Let's do this!","['English', 'Catalan']",[],4,"{'iOS Development': 7, 'Figma': 6, 'PyTorch': 3, 'Android Development': 7, 'Flutter': 6, 'Natural Language Processing': 7, 'AWS/Azure/GCP': 4, 'IoT': 4}","['AED Challenge', 'Mango Challenge', 'Restb.ai Challenge']"
662230f0-a069-402e-8270-5e7bce63718d,Emma Winters,Intermediate,5,"I'm all about soaking up the atmosphere and making memories this datathon! For me, it's all about the connections I make and the fun I have. I'd love to collaborate with fellow datathoners on as many projects as I can, learn from their perspectives, and gain new experiences. I'm not about competing with others or stressing out over winning; I just want to be part of an awesome community, learn from the challenges, and enjoy the ride! Let's make some friends and create some unforgettable experiences!",['English'],[],4,"{'Agile Methodology': 4, 'Computer Vision': 6, 'Git': 4, 'SQL': 2, 'Rust': 7, 'Figma': 5, 'Java': 4, 'Data Analysis': 6, 'React Native': 2}","['Mango Challenge', 'AED Challenge', 'Restb.ai Challenge']"
9e3dec53-3ad8-41b8-a045-6af0fe28b9f7,Aurélien Langdon,Intermediate,4,"My objective for this datathon is to bring home the trophy! I'm a competitive bug by nature, and I thrive under pressure. I've participated in four hackathons before, and I'm convinced that with enough caffeine, coding, and collaboration, I can take home the top prize. I'm looking forward to the rush of adrenaline and the thrill of tackling complex challenges head-on. Bring it on!","['English', 'French']",[],4,"{'Rust': 5, 'Android Development': 6, 'iOS Development': 3, 'Natural Language Processing': 5, 'Agile Methodology': 3, 'AWS/Azure/GCP': 5, 'TypeScript': 2}","['Mango Challenge', 'AED Challenge', 'Restb.ai Challenge']"
e1e56330-6555-41ca-8028-18d751ce7f63,Emily Wilson,Advanced,8,"Hey! I'm Emily. For this datathon, my objective is all about having a blast with fellow participants! I'm super excited to mingle with new people, participate in as many events as I can, and learn from others while having fun. I'm not too stressed about winning, as I've had some experience with hackathons before and would love to focus on the social side of things. I'm hoping to make some awesome friends, enjoy some cool talks and workshops, and make this a datathon to remember!",['English'],[],4,"{'Machine Learning': 9, 'Flutter': 3, 'iOS Development': 5, 'Python': 6, 'PyTorch': 6, 'Blockchain': 7, 'UI/UX Design': 8, 'SQL': 5, 'IoT': 5, 'HTML/CSS': 3}","['AED Challenge', 'Restb.ai Challenge', 'Mango Challenge']"
867ef49e-3fe3-4818-a3ce-b397615ec31a,Avery Rae Thompson,Advanced,6,"Hey, I'm Avery! As a seasoned hackathon veteran, my main goal for this datathon is to crush it and take home the top prize. I've honed my programming skills through extensive coding and previous hackathons, and I'm now seeking the ultimate challenge. I'm laser-focused on winning and don't plan on settling for anything less. Expect me to be glued to my laptop, pouring over lines of code, and collaborating with my teammates to create a game-changing solution. Bring it on - I'm ready to take on the competition and prove my prowess.",['English'],[],4,"{'PostgreSQL': 9, 'SQL': 9, 'PyTorch': 5, 'Flutter': 9, 'Docker': 3, 'iOS Development': 9, 'Java': 4, 'Android Development': 7, 'Python': 8, 'HTML/CSS': 3}","['Restb.ai Challenge', 'Mango Challenge', 'AED Challenge']"
d1c120a3-498a-4a25-8928-f1128e31710d,Ling Wong,Intermediate,5,"I'm all about going in to win. My main objective is to crush the competition and take home that top prize. I've been to five hackathons before and I know what it takes to come out on top. I've got a solid foundation in programming and I'm ready to bring my A-game to this datathon. My goal is to outsmart and outwork everyone else and be the last one standing. I'm not interested in half-baked projects or just showing up for the free food - I want to bring a solution that's innovative, scalable, and a game-changer. Expect tough competition from me!",[],[],4,"{'Natural Language Processing': 4, 'Android Development': 5, 'iOS Development': 7, 'IoT': 5, 'Java': 4, 'React': 2, 'Go': 7, 'Blockchain': 5}","['Restb.ai Challenge', 'AED Challenge', 'Mango Challenge']"
d4d98f7a-d956-4ef5-ab2c-aed24b35a045,Alexander Ryder,Intermediate,5,"Hey there! I'm Alex, and I'm super excited to be part of this datathon. Honestly, I'm not here to be a competitive shark, and I don't care if I win or not. What I'm looking for is a blast, some amazing new friends, and an experience that'll make me forget about my stressful uni schedule. I want to learn new stuff, try new things, and just have a laugh with fellow participants. Whether it's hacking away on some code, attending a workshop, or busting out some dance moves in the arcade room - I'm all in! Bring it on!",['English'],[],4,"{'Android Development': 2, 'UI/UX Design': 2, 'Blockchain': 7, 'MongoDB': 7, 'JavaScript': 6, 'Rust': 6, 'Docker': 6}","['Mango Challenge', 'Restb.ai Challenge', 'AED Challenge']"
93cce408-4899-4667-ac4d-bc5dd6281e3c,Aurora Englishesi,Intermediate,5,"For me, this datathon is all about growth and self-improvement. I'm excited to dive into new technologies and challenges, learning from my peers and mentors. My main objective is to enhance my problem-solving skills and expand my knowledge in data science and machine learning. I'm looking forward to experimenting with different approaches, and getting out of my comfort zone. Through this datathon, I hope to develop a stronger foundation in my degree and become a more skilled programmer, ultimately setting myself up for success in my future career.","['English', 'Italian']",[],4,"{'Android Development': 5, 'C++': 4, 'HTML/CSS': 7, 'TensorFlow': 2, 'PostgreSQL': 7, 'React Native': 6}","['Restb.ai Challenge', 'AED Challenge', 'Mango Challenge']"
2647ff5e-eb6b-4b6c-8531-08cc5587ca68,Sofía Leonhart,Intermediate,4,"I'm super excited to take part in this datathon and I'm focusing on improving my skills above all. As an intermediate coder, I want to learn from the best, experiment with new tech and stretch my coding muscles. I'd love to dive deep into machine learning and data analysis, and learn from the expert talks and workshops. I'm all about taking my programming to the next level, so I'm prioritizing learning and skill-building over winning. Can't wait to soak up all the knowledge and take home some new tricks to rock in my next project!","['Spanish', 'French', 'German', 'Portuguese']",[],4,"{'PyTorch': 6, 'iOS Development': 5, 'Agile Methodology': 7, 'Data Visualization': 3, 'MongoDB': 7, 'TensorFlow': 7, 'SQL ': 2}","['Restb.ai Challenge', 'AED Challenge', 'Mango Challenge']"
