id,name,experience_level,hackathons_done,objective,preferred_languages,friend_registration,preferred_team_size,programming_skills,interest_in_challenges
e2e570ae-5283-48de-a9cf-933c693d78bd,Luciana Isabella Fletcher,Beginner,0,"I'm a competitive person through and through, so my objective for this datathon is to go all in and give it my all to win. I've always been someone who rises to the challenge and thrives under pressure, so I'm looking forward to the fast-paced environment and the thrill of racing against the clock. My goal is to analyze the data and come up with innovative solutions that truly stand out, even if it means putting in the extra effort. Bring it on!","['English', 'Spanish', 'Italian']",[],4,"{'Android Development': 2, 'Docker': 3, 'Go': 3}","['Restb.ai Challenge', 'Mango Challenge', 'AED Challenge']"
0f678049-21ab-4df2-8ba1-48340d97bd84,Llorenç Alexandra Grant,Intermediate,4,"Hey there! I'm Llorenç, and my objective for this datathon is to have a blast and meet some amazing people! As a student, I've had limited opportunities to network and collaborate with like-minded individuals, so I'm super excited to finally connect with fellow coders and data enthusiasts. I'm not as much about winning or trying to be the best (although I do love a good challenge!), I'm more about creating lifelong friendships and having a kick-butt time. Let's make some unforgettable memories, shall we?","['English', 'Catalan']",[],4,"{'SQL': 4, 'Git': 3, 'React': 5, 'Figma': 7, 'Python': 4, 'Blockchain': 5}","['Restb.ai Challenge', 'AED Challenge', 'Mango Challenge']"
76112bd4-ac69-4588-b02b-d480c0709660,Ava Ryder,Beginner,1,"I'm all about making this datathon an unforgettable experience! My main goal is to meet fellow data enthusiasts, build new friendships, and have a blast together. I'm excited to participate in as many events as I can, whether it's a coding challenge, workshop, or even just a casual game night. I'm not too competitive about winning, and instead, I want to focus on learning new skills and having fun with the community. Bring on the adventure!",['English'],"['718026ee-ef77-46c2-bc93-29d31ac30a62', '47cc27d9-7ae4-41c9-86eb-48c4423616dd']",4,"{'JavaScript': 1, 'SQL': 4}","['Restb.ai Challenge', 'Mango Challenge', 'AED Challenge']"
b29dc0bd-9753-44d5-8643-b8f9e1e1714b,Ruby Rachel Thompson,Intermediate,5,"Hey! My objective for this datathon is to soak up as much knowledge as I can and level up my programming skills. I'm an 18-year-old student, and while I've participated in a few hackathons before, I feel like I still have a lot to learn. I'm excited to dive into new technologies and work on projects that challenge me. I'm not really competing to win, but rather to improve my coding skills and confidence. I'm looking forward to meeting fellow data enthusiasts, asking questions, and gaining valuable experience in the process!",['English'],[],4,"{'Android Development': 6, 'iOS Development': 6, 'SQL': 7, 'React Native': 5, 'Rust': 3, 'PostgreSQL': 6}","['AED Challenge', 'Restb.ai Challenge', 'Mango Challenge']"
9e22c406-1262-4523-8773-3ccf99f5e5bc,Sofia Rachel Morales,Intermediate,2,"My objective for this datathon is to come out on top and bring home the win! I'm not here to make friends or soak up knowledge (although that's a bonus). My sole focus is on solving the challenges and beating the competition. I've participated in a few hackathons before, so I know what it takes to win. I've honed my skills, I'm pumped up, and I'm ready to bring home the gold. I'm looking forward to putting my coding skills to the test and proving to myself that I'm one of the best.","['English', 'Spanish']",[],4,"{'HTML/CSS': 5, 'Blockchain': 6, 'Android Development': 3, 'iOS Development': 7, 'Git': 2, 'IoT': 6, 'Python': 6}","['AED Challenge', 'Restb.ai Challenge', 'Mango Challenge']"
74f3e62c-3eaa-40b5-ac44-fc320d7da450,Alejandra Emerson,Intermediate,5,"My objective for this datathon is to learn as much as I can and improve my programming skills. I've already had some experience with hackathons, but I know there's always more to learn and I'm excited to dive deeper into new technologies and topics. I'm looking forward to picking the brains of other participants, hearing their experiences, and maybe even discovering some new areas of interest. I want to leave this event feeling challenged, inspired, and equipped with new knowledge and skills to take back to my own projects and further my education.","['English', 'Spanish']",[],4,"{'PyTorch': 3, 'React Native': 4, 'PostgreSQL': 4, 'AWS/Azure/GCP': 7, 'Python': 3, 'Machine Learning': 4, 'TypeScript': 2, 'Figma': 5, 'SQL': 4}","['Mango Challenge', 'Restb.ai Challenge', 'AED Challenge']"
a76f0006-9a75-428e-be8f-3ee51bee14d2,Sofia Reyes,Intermediate,4,"I'm Sofia, and my objective for this datathon is clear: I'm here to win. With a strong background in competitive hackathons, I'm all about the rush of adrenaline that comes with beating the clock and taking home that top prize. I'm eager to push my limits, work tirelessly, and leverage my existing skills to craft a solution that stands out from the rest. Bring it on - I'm ready to outsmart and outpace the competition!","['English', 'Spanish']",[],4,"{'Flask': 4, 'TypeScript': 5, 'PyTorch': 6, 'iOS Development': 7, 'PostgreSQL': 7}","['AED Challenge', 'Restb.ai Challenge', 'Mango Challenge']"
caeec731-c1c1-4eea-8072-d166ed4c6770,Asher Lucas,Intermediate,5,"Hey there! So, my objective for this datathon is to have a blast while making new friends and trying out as many events as possible. I'm not super competitive when it comes to winning, so I'm more focused on learning new stuff, jamming with others, and taking in the datathon vibes. I'm all about meeting new people, discovering fresh skills, and sharing a laugh or two. If I happen to score a win along the way, awesome! But my main goal is to leave here feeling inspired, exhausted, and maybe a little wiser, but mostly just stoked that I participated!",['English'],[],4,"{'Android Development': 7, 'SQL': 6, 'Blockchain': 7, 'Agile Methodology': 3, 'Python': 5, 'HTML/CSS': 5, 'C++': 7, 'iOS Development': 5, 'Go': 5}","['Mango Challenge', 'AED Challenge', 'Restb.ai Challenge']"
4d434bc3-c353-4d0c-a4ca-69860d93b54a,Mercè Elena Thompson,Beginner,1,"As a curious and adventurous participant, I'm looking to make this datathon a blast! My objective is to have as much fun as possible while making new friends and taking part in as many events as I can. I'm not super experienced in programming, but I'm eager to learn and get a feel for the vibe of the community. For me, it's all about being immersed in the excitement of it all, trying out new things, and meeting like-minded folks who share my passion for tech. Let's make some unforgettable memories!","['English', 'Catalan']",[],4,"{'Git': 4, 'HTML/CSS': 3}","['Mango Challenge', 'Restb.ai Challenge', 'AED Challenge']"
d9c40299-abd9-4b2f-bdcc-5e45f0e19ffc,Luz Elena Sawyer,Beginner,2,"I'm all about the thrill of victory, so my objective for this datathon is to dominate and bring home that top prize! I'm gonna immerse myself in this challenge, stay focused, and push myself to the limit. I've done hackathons before, and I know how important it is to prioritize task execution and efficient teamwork. I'm ready to give it my all and see if my coding skills can stand out from the crowd. Let the competition begin!","['English', 'Spanish', 'Portuguese']",['74425515-a7ef-4ca9-a8e4-ab0c0c086ace'],2,"{'React': 1, 'Data Analysis': 4, 'Machine Learning': 1}","['AED Challenge', 'Mango Challenge', 'Restb.ai Challenge']"
e085c763-f022-4c76-9c59-516bb31d524b,Aleixandra Englishworth,Intermediate,5,"Hey there! I'm Aleixandra, and for this datathon, my goal is to have a blast, meet some amazing people, and soak up as much goodness as possible. I'm not trying to win or brag about my skills - I just want to have fun, learn new things, and be part of a dynamic community. I'm all about making connections, attending events, and trying out cool projects. I'd love to hang out with my new friends, share some laughs, and see where the datathon takes us. That sounds like an awesome adventure to me!","['English', 'Catalan']",[],4,"{'TensorFlow': 4, 'Natural Language Processing': 7, 'Agile Methodology': 6, 'Python': 5, 'Flutter': 3}","['Mango Challenge', 'AED Challenge', 'Restb.ai Challenge']"
5ec97c83-30ba-4855-bc3d-0ad8bcfa85be,Isabella Rivera,Intermediate,1,"My objective for this datathon is clear: I'm here to win! With one hackathon under my belt, I'm confident in my abilities to tackle tough challenges. I'm not looking to make any new friends (not that that wouldn't be cool), nor am I here to sit back and just learn (although, I mean, I'll definitely be learning). Nope, I'm all about taking home that top prize. I've got a few tricks up my sleeve and a burning desire to prove myself. Bring it on, I'm ready to take the datathon by storm!","['English', 'Spanish']",[],4,"{'Computer Vision': 3, 'Blockchain': 2, 'Go': 2, 'React Native': 3, 'Flask': 3, 'Agile Methodology': 6}","['AED Challenge', 'Restb.ai Challenge', 'Mango Challenge']"
294c7041-c33b-4aca-8108-73d7e69aa39f,Lena Valencia Hansen,Intermediate,2,"I'm super excited to be part of this datathon! My goal is to have an amazing time, meet new people, and learn some cool stuff along the way. I'm looking forward to participating in as many events as possible, whether it's coding challenges, workshops, or just casual meetups. I'm a big believer that networking is all about building genuine connections, and I hope to come out of this with some new friends and a renewed sense of enthusiasm for tech and learning. Bring on the caffeine and creative problem-solving!","['English', 'Spanish', 'German']",[],4,"{'C++': 3, 'Machine Learning': 5, 'JavaScript': 3, 'Go': 3, 'Natural Language Processing': 3, 'SQL': 5, 'Flutter': 2, 'Android Development': 6, 'iOS Development': 2}","['Restb.ai Challenge', 'Mango Challenge', 'AED Challenge']"
75d2add0-a264-4b9a-b582-9e98f19d68a8,Eva Ríos Morales,Beginner,1,"My objective for this datathon is to have an amazing time with fellow participants! I want to dive head-first into all the fun activities, workshops, and events, and make the most of this experience. I'm excited to meet new people and learn from each other's perspectives, but more than that, I'm hoping to make some new friends. Let's say, 10 or 15 solid connections! I'm looking forward to laughing, sharing stories, and making unforgettable memories. Bring on the datathon!","['English', 'Catalan', 'Spanish']",[],4,"{'docker': 4, 'ios': 2, 'iot': 3}","['Mango Challenge', 'AED Challenge', 'Restb.ai Challenge']"
9397831c-857c-48a0-8104-580f1f95dafe,Lidia Schnell,Beginner,2,"My objective is clear: I'm here to win! With my beginner programming skills, I'm eager to put my coding abilities to the test and take home the top prize. I've participated in a couple of hackathons and learned a thing or two, but I'm not satisfied with just surviving - I want to conquer this datathon and be recognized as one of the top competitors. I'm ready to put in the long hours, stay focused, and push myself to the limit to come out on top. Bring it on!","['Catalan', 'German']",[],3,"{'Data Analysis': 1, 'PostgreSQL': 3, 'Docker': 4, 'IoT': 1}","['Mango Challenge', 'AED Challenge', 'Restb.ai Challenge']"
a4e7f6fc-59bb-4589-a145-f8c8e65f1d3d,Sofia Jenkins Garcia,Intermediate,2,"Honestly, I'm here to crush this datathon! My objective is clear: win. I've got a decent amount of programming experience under my belt and I'm eager to showcase my skills. I'm always up for a challenge and the thrill of competition is a major motivator for me. I'll be dedicating all my energy to working on the problems, collaborating with my team, and making sure our solution stands out. Nothing would be sweeter than walking away with that top prize - let the games begin!","['English', 'Spanish']",[],4,"{'SQL': 3, 'JavaScript': 4, 'TypeScript': 5, 'Android Development': 2, 'Machine Learning': 3}","['Mango Challenge', 'AED Challenge', 'Restb.ai Challenge']"
0da9c0a2-aed4-4350-ad57-fc96b096bdd8,Arianna Sansierra,Intermediate,2,"My objective for this datathon is to dive deep into new technologies and ideas. With two hackathons under my belt, I've gained a good sense of how to work in a team, but I feel like I've plateaued in terms of skill level. I'm excited to take this opportunity to step out of my comfort zone, try new programming languages and tools, and come away with a newfound confidence in my abilities. I'm all about learning and self-improvement, so I'm looking forward to networking with others who share my passion and expertise. Let's do this!","['English', 'Catalan', 'Spanish']",[],4,"{'Agile Methodology': 7, 'Natural Language Processing': 2, 'Git': 2, 'IoT': 7, 'Docker': 7}","['Restb.ai Challenge', 'AED Challenge', 'Mango Challenge']"
771bba43-fef2-439d-b2f8-9888bddbf6ea,Alexis Santos,Intermediate,2,"Hey! I'm Alexis. For this datathon, I'm all about having a blast with like-minded people. I want to meet new friends, attend all the awesome events they'll have, and enjoy the vibe. I'm not too worried about winning or even being super awesome at coding - I'm more excited about collaborating with others, trying new challenges, and learning from everyone's expertise. I hope to make some unforgettable memories with the community, and maybe, just maybe, come out with some fresh skills and ideas to boot! Bring it on!","['English', 'Spanish']",[],4,"{'Python': 5, 'Rust': 6, 'Android Development': 7, 'Docker': 2}","['AED Challenge', 'Mango Challenge', 'Restb.ai Challenge']"
453aed48-4b53-4189-a5b7-e50714aecdd0,Aurora Rory Sørnes,Beginner,0,"Hey! I'm all about having an awesome time and meeting new people at this datathon. I'm not too worried about winning or getting all technical, I just want to have fun and be part of this awesome community. I want to soak up the vibe, attend as many events as I can, and chat with fellow datathoners about their projects. I'm hoping to learn something new, but more importantly, I want to make some rad new friends and memories to look back on. Let's get this datathon party started!",[],[],4,"{'iOS Development': 1, 'IoT': 1, 'Python': 2, 'Flutter': 3}","['Restb.ai Challenge', 'AED Challenge', 'Mango Challenge']"
6b20e3ec-044e-4e53-b6db-fc88f015dff4,Camila Alexandra Martin,Intermediate,2,"Hey there! As a second-year student, I'm super stoked to be participating in this datathon! My goal is to make some amazing memories, meet fellow enthusiasts, and have a blast while doing so. I want to dive into the workshops, mingle with fellow participants, and soak up as much fun as I can! Winning isn't necessarily on my mind, as long as I take away something new and leave with friendships that will last beyond this datathon. Let's make some unforgettable moments together!","['English', 'Spanish']",[],4,"{'PostgreSQL': 7, 'Computer Vision': 3, 'Blockchain': 7, 'HTML/CSS': 5}","['Restb.ai Challenge', 'AED Challenge', 'Mango Challenge']"
7bb47f4e-c95d-450d-af4a-55e5d5fc5aa7,Paloma Roussillon.,Intermediate,4,"My objective for this datathon is straightforward - I'm here to win! As a 2nd-year student with a passion for coding, I'm eager to put my skills to the test and come out on top. With 4 hackathons under my belt, I've learned what it takes to work under pressure and stay focused. I'm ready to pour my energy into cracking this competition and prove my mettle. I'm all about strategy, creativity, and delivering the best possible solution. Let's do this and take the top prize!","['English', 'Catalan', 'Spanish', 'French']",[],4,"{'MongoDB': 6, 'Android Development': 3, 'TypeScript': 6, 'AWS/Azure/GCP': 6, 'Agile Methodology': 2, 'Go': 2, 'IoT': 3, 'Data Visualization': 3, 'Docker': 6}","['AED Challenge', 'Mango Challenge', 'Restb.ai Challenge']"
8ef7b4db-f613-4dfa-bb34-28115f04a1df,Isabella Fifi García,Intermediate,2,"You know what? I'm all about making the most out of this datathon experience! My goal is to have a blast, make new friends, and participate in as many events as possible. I want to soak up the vibes, learn a thing or two (without stressing too much about the techy stuff), and have unforgettable moments with like-minded people. If someone lands a prize, that's awesome, but my priority is about the connections I make, the stories I hear, and the memories we create. Let's do this, datathon squad!","['English', 'Spanish', 'French']",[],4,"{'Computer Vision': 5, 'iOS Development': 6, 'Natural Language Processing': 7, 'React': 6, 'Blockchain': 3, 'AWS/Azure/GCP': 4, 'React Native': 5}","['Mango Challenge', 'AED Challenge', 'Restb.ai Challenge']"
471b6000-84ae-4c18-bcbc-615a0b4af65e,Aurora Valencia Dumont,Beginner,0,"I'm all about going for the win! My objective for this datathon is to give it my all and compete at the highest level. I'm determined to learn from the experience and improve my skills, but at the end of the day, I want to stand out from the crowd and claim that top spot. I'm willing to put in the long hours and push myself to the limit to achieve that. It's going to be tough, but I'm excited to test my abilities against the best and see how far I can go.","['English', 'Catalan', 'Spanish', 'French', 'German']",[],2,"{'Docker': 3, 'PostgreSQL': 1, 'Flutter': 3, 'TypeScript': 3}","['AED Challenge', 'Restb.ai Challenge', 'Mango Challenge']"
e9ceb653-bedc-4e6c-819d-bec0d6e8ba7c,Laia Elena Summers,Intermediate,1,"My objective for this datathon is to learn as much as I can and level up my skills! As a student, I'm always looking for opportunities to expand my knowledge and get hands-on experience with real-world problems. I'm especially interested in diving deeper into machine learning and data visualization. I want to leave this event with new tools in my toolbox, fresh insights to apply to my studies, and a sense of accomplishment from pushing my boundaries. Bring on the challenges and let me get to learning!","['English', 'Catalan', 'Spanish']",[],4,"{'Data Analysis': 4, 'Python': 4, 'iOS Development': 2, 'Android Development': 4, 'Java': 5, 'TypeScript': 5}","['Restb.ai Challenge', 'Mango Challenge', 'AED Challenge']"
73f736ee-27e7-4c18-851b-16b7aff7cbc0,Aurora Dupont-Larios,Advanced,9,"I'm all about vibing with my fellow datathon enthusiasts! My objective is to make the most of this amazing experience by having an absolute blast with new friends. I'd love to participate in as many events as possible, whether it's a data challenge, a workshop, or just a casual meetup. I'm not too fussed about winning, I'd rather be having fun and learning from everyone's unique perspectives. By the end of the datathon, I hope to have formed some lifelong connections and memories that'll keep me buzzing long after the competition ends.","['English', 'Spanish', 'French']",[],4,"{'Android Development': 3, 'Machine Learning': 9, 'Figma': 7, 'HTML/CSS': 6, 'Flutter': 8, 'IoT': 8, 'React': 4, 'Python': 3, 'Data Visualization': 4, 'UI/UX Design': 7, 'Data Analysis': 5, 'Blockchain': 6}","['AED Challenge', 'Restb.ai Challenge', 'Mango Challenge']"
e2c6e3ad-efbd-435a-890d-f1900763c6c1,Ariana Fernanda Santos,Advanced,9,"I'm excited to participate in this datathon with a focus on expanding my skillset and learning as much as I can. My goal is to take on new challenges and master techniques I've always been curious about. I want to push myself out of my comfort zone and explore new areas of programming, whether it's machine learning, data visualization, or something entirely different. I'm looking forward to absorbing knowledge from other participants and mentors, and I hope to leave this event with a fresh perspective and a new set of skills to incorporate into my future projects.","['English', 'Spanish', 'Portuguese']",[],4,"{'Data Analysis': 6, 'PyTorch': 8, 'Flutter': 5, 'Rust': 7, 'iOS Development': 9, 'Machine Learning': 8, 'TensorFlow': 5, 'Flask': 8}","['Restb.ai Challenge', 'AED Challenge', 'Mango Challenge']"
4759003b-1286-488c-8ded-3a0a422f0cbd,Alessia Sandoval,Intermediate,1,"Hey, my goal for this datathon is straightforward - I'm here to compete and win! As a third-year computer science student, I've honed my programming skills and I'm eager to put them to the test. I want to tackle the challenges head-on, learn from the judges' feedback, and outdo my fellow participants to claim the top spot. I'm all about strategy, efficiency, and pushing myself to the limit. If I can take home the prize, it'll be the icing on the cake. Bring it on!","['English', 'Spanish']",[],4,"{'PyTorch': 5, 'Android Development': 2, 'React Native': 5, 'iOS Development': 2}","['Restb.ai Challenge', 'AED Challenge', 'Mango Challenge']"
a97116bf-5a80-495c-881f-2e639469e624,Alexandra Francine Valencia,Advanced,9,"I'm Alexandra, and I'm all about vibes and networking at this datathon! My objective is to soak up the experience and create lasting connections with fellow data enthusiasts. I want to attend as many events as possible, learn from the industry experts, and participate in workshops that will help me improve my skills while having a blast. I'm not too fussed about winning - I'm all about making memories and sharing this incredible experience with like-minded folks. Expect me to be the friendly face with a constant smile and an open mind!","['English', 'Spanish', 'French']",[],3,"{'UI/UX Design': 8, 'TensorFlow': 3, 'Data Analysis': 6, 'Natural Language Processing': 3, 'iOS Development': 7, 'Go': 9, 'Java': 6, 'Figma': 4, 'HTML/CSS': 8, 'Blockchain': 4, 'React Native': 8, 'Agile Methodology': 6}","['Mango Challenge', 'Restb.ai Challenge', 'AED Challenge']"
420afe02-5102-47a3-835e-d5c99cf4432c,Aleixandra Maria Martínez,Beginner,1,"I'm all about the win, folks! As a young programmer with limited experience, I'm here to learn and improve, but my primary objective is to compete and try to win. I've participated in one hackathon before, and it was an incredible rush! I'm excited to test my skills and push myself to the limit. I'm looking to work with a team to create an innovative and impactful project that will wow the judges and give me that sweet, sweet first prize! I'm ready to put in the long hours, hustle, and grind to take home the win.","['English', 'Catalan', 'Spanish']",[],4,"{'Android Development': 1, 'SQL': 3, 'IoT': 3}","['Restb.ai Challenge', 'Mango Challenge', 'AED Challenge']"
2ebd3551-db8e-4b14-90c6-e20290162463,Ariella Sanchez,Intermediate,2,I'm all about the competition. My goal is to give it my all and aim for the top prize. I've got two hackathons under my belt and I've learned a thing or two about what it takes to deliver a killer project. Now it's time to up my game and prove myself. I'm looking forward to collaborating with a talented team and pushing myself to the limit to come up with a innovative solution that wows the judges. Bring it on!,"['English', 'Spanish']",[],4,"{'Android Development': 6, 'Machine Learning': 7, 'Flutter': 3, 'JavaScript': 7, 'Flask': 3, 'Git': 4, 'Agile Methodology': 5, 'SQL': 5, 'Python': 6}","['Mango Challenge', 'AED Challenge', 'Restb.ai Challenge']"
2873574c-1713-40f9-b59f-007eb8d09191,Lily Rachel Martin,Intermediate,2,"I'm super focused on giving it my all and crushing it at this datathon! I want to dive in head-first and give 110% effort to win. I've been preparing and studying, and I'm excited to put my skills to the test. I'm not here to mess around, I'm here to come out on top and prove to myself that all my hard work has paid off. I'm ready to roll up my sleeves, hustle hard, and take home that top prize. Watch out, competition - Lily's got game!",['English'],[],4,"{'PostgreSQL': 2, 'Figma': 2, 'MongoDB': 6, 'PyTorch': 3}","['Mango Challenge', 'Restb.ai Challenge', 'AED Challenge']"
c92e7134-0f4e-4d05-8382-974e293cb902,Aura Victòria Estévez,Intermediate,5,"My objective for this datathon is to take advantage of this amazing opportunity to level up my skills and learn as much as I can. I've attended five hackathons before, but I've always had a 'jack-of-all-trades' approach, trying to learn a little of everything but never really mastering any specific skill. I want to focus on improving my Python skills, exploring data visualization tools like Tableau, and learning some machine learning techniques. I'm excited to dive deeper into these areas and leave this datathon feeling more confident and prepared for future coding challenges.","['English', 'Catalan', 'Spanish', 'French']",[],4,"{'IoT': 7, 'Go': 7, 'SQL': 6, 'React': 4, 'Figma': 3, 'Agile Methodology': 7, 'Flask': 2}","['AED Challenge', 'Restb.ai Challenge', 'Mango Challenge']"
dd3c33d5-ab83-4a63-b424-a71530e54f47,Camila Francoisi Langley,Intermediate,4,"As someone who's participated in four hackathons already, I'm used to pushing myself to be the best. This datathon is no exception - I'm coming for the win. My main objective is to compete and try my hardest to take home that top prize. I'll be digging deep, pouring over the dataset, and bringing all my problem-solving skills to the table to create something truly groundbreaking. I'm ready to give it my all and make a statement. See you at the finish line!","['English', 'Spanish', 'French', 'Italian']",[],4,"{'PostgreSQL': 6, 'Blockchain': 4, 'React': 2, 'Natural Language Processing': 5, 'AWS/Azure/GCP': 4, 'Agile Methodology': 3, 'Git': 5}","['AED Challenge', 'Mango Challenge', 'Restb.ai Challenge']"
